URL,Keywords
http://ftps1a4l1.adwitads.com/ImageBank/Automotive & Transportation/Tire/11383691_xxl.eps,"background, banner, bicycle, bike, black, blob, car, computer, design, dirt, dirty, element, generated, graphic, grunge, illustration, image, ink, isolated, mark, motorbike, nobody, outline, painting, pattern, plackard, print, race, road, rubber, set, silhouette, skid, skidding, sport, street, tire, track, transport, tread, truck, vehicle, wheel, white, yellow"
http://ftps1a4l1.adwitads.com/ImageBank/Beverages/Beer/10301487_xxl.eps,"banner, bavaria, bavarian, beer, bier, bratwurst, bread, brezel, bun, cartoon, copy, design, deutsche, elements, fair, festival, food, fork, fresh, german, germany, glass, golden,header, heart, hot, hotdog, icon, illustration, isolated, label, mug, munich, octoberfest, oktoberfest, pilsner, pretzel, restaurant, ribbon, sign, space, stein, symbol, text, title"
http://ftps1a4l1.adwitads.com/ImageBank/Education & Training/Day Care Center/9774531_xxl.eps,"adult, affection, affectionate, blue, boy, brother, colors, couple, dad, daughter, drawing, family, father, female, freehand, fun, girl, happy, healthy, home, human, husband, illustration, image, joy, kid, life, lifestyle, love, male, man, mind, mother, orange, parent, people, person, relationship, scalable, sentiment, sister, son, symbol, three, violets, want, wife, woman"
http://ftps1a4l1.adwitads.com/ImageBank/General/Background/10028550_xxl.eps,"abstract, advertise, art, background, banner, beautiful, border, brochure, colorful, cover, creative, dance, decoration, design, digital, document, editable, effect, fantasy, file, floral, flyer, folder, frame, graphic, illustration, leaflet, line, marketing, modern, music, paper, party, pattern, poster, presentation, print, promotion, publication, shape, splash, square, style, stylish, swirl, t.v. television, template, transparency, transparent, twirl, wave"
http://ftps1a4l1.adwitads.com/ImageBank/General/Background/10054952_xxl.eps,"abstract, advertise, art, background, banner, beautiful, brochure, colorful, cover, creative, dance, decoration, design, digital, document, editable, effect, fantasy, file, floral, flyer, folder, frame, graphic, illustration, leaflet, line, marketing, modern, music, paper, party, pattern, poster, presentation, print, promotion, publication, shape, square, style, stylish, template, transparency, transparent, wave"
http://ftps1a4l1.adwitads.com/ImageBank/General/Background/10267131_xxl.eps,"abstract, art, artwork, award, background, banner, bookplate, border, brown, calligraphy, certificate, deco, decoration, decorative, design, dingbats, draw, drawings, elegant,elements, embellish, engrave, frame, graphic, illustrations, lines, motif, old, ornament, ornamental, ornamentation, panel, patterns, refined, scroll, shapes, simple, space,template, text, victorian, vines, vintage"
http://ftps1a4l1.adwitads.com/ImageBank/General/Background/10290846_xxl.eps,"abstract, air, arc, arch, art, background, beams, beautiful, blue, border, botanic, botany, brush, bunch, camomiles, chamomiles, colorful, daisy, day, design, ecology,environment, environmental, field, floral, flowers, foliage, grass, green, herb, herbal, image, landscape, lawn, leaf, meadow, nature, outdoor, pasture, pattern, plant, rainbow,rays, season, sky, spring, summer, sun"
http://ftps1a4l1.adwitads.com/ImageBank/General/Background/10343113_xxl.eps,"abstract, art, backdrop, background, balloons, beams, birthday, black, bow, bright, brilliant, busy, celebrate, celebration, circles, color, colorful, colour, decoration, design, dream, effect, elegance, entertainment, fantasy, festive, glitter, glittering, glow, glowing, graphic, halo, illuminated, illustration, light, modern, ray, ribbon, ribbons, romance, round, serpentine, shape, shimmer, shine, shiny, sky, sparkle, stars, tapes, toys, translucent, transparent, vivid, wallpaper"
http://ftps1a4l1.adwitads.com/ImageBank/General/Background/10394285_xxl.eps,"abstract, art, background, brochure, brown, card, celebration, classic, clip art, concept, cooking, cover, creative, decorate, decoration, design, dessert, dining, dinner, dishes, drink, elegance, elegant, element, floral, frame, grand, holiday, identity, illustration, lunch, menu, occasion, ornament, paper, pattern, prints, restaurant, retro, salads, seamless, set, symbol, template, text, texture, traditional"
http://ftps1a4l1.adwitads.com/ImageBank/General/Background/10410349_xxl.eps,"adult, attitude, background, beautiful, beauty, caucasian, celebration, club, cocktail, dance, disco, drink, enjoyment, entertainment, fashion, female, girl, glamour, hand, happy,holding, hot, joy, joyful, lifestyle, looking, model, modern, music, night, nightclub, party, people, person, portrait, posing, pretty, relaxed, smiling, standing, stunning, vogue,white, woman, young"
http://ftps1a4l1.adwitads.com/ImageBank/General/Background/10424045_xxl.eps,"abstract, advertise, art, background, banner, beautiful, blue, border, brochure, bubble, card, circle, colorful, cover, creative, decoration, design, digital, document, editable,effect, fantasy, file, flyer, folder, frame, graphic, happy, illustration, leaflet, marketing, menu, modern, paper, pattern, poster, presentation, print, promotion, publication,shape, splash, style, stylish, template, transparent, water, white"
http://ftps1a4l1.adwitads.com/ImageBank/General/Background/10452282_xxl.eps,"anniversary, backdrop, background, birthday, blank, bow, card, celebration, christmas, copy, decoration, decorative, design, element, festive, frame, gift, golden, greeting,happy, holiday, horizontal, illustration, knot, love, navidad, new, noel, pattern, present, red, ribbon, romance, romantic, satin, season, seasonal, shiny, silk, space, tied,traditional, valentines, white, wrap, xmas, year"
http://ftps1a4l1.adwitads.com/ImageBank/General/Background/10481726_xxl.eps,"background, banner, business, commerce, commercial, communication, company, corporate, design, earth, ecology, environment, globe, grass, icon, international, internet,label, layout, map, menu, mobile, modern, office, origami, page, paper, phone, presentation, profile, road, set, sheet, sign, site, slider, smart phone, solution, structure, style,tag, template, web, website, www"
http://ftps1a4l1.adwitads.com/ImageBank/General/Background/10562046_xxl.eps,"art, backdrop, background, banner, beautiful, billboard, black, blot, bright, club, concert, crowd, dark, decoration, design, disco, entertainment, event, fantasy, fashion, female, flyer, fun, funky, girl., graphic, illustration, invitation, light, modern, music, musical, night, party, people, performance, pink, place, pop, poster, ray, rock, show, silhouette, singer, star, template, text, wallpaper"
http://ftps1a4l1.adwitads.com/ImageBank/General/Background/11139609_xxl.eps,"background, banner, bar, brand, cafe, classic, coffee, cup, design, drink, font, food, icon, italian, japanese, label, logo, menu, modern, pizza, restaurant, set, shop, sign, sushi, symbol, template, title, vertical"
http://ftps1a4l1.adwitads.com/ImageBank/General/Background/11248712_xxl.eps,"background, beach, boats, dune, heat, holidays, horizon, horizontal, nature, ocean, paradise, resort, sailboats, sand, sea, shiny, sky, summer, sun, sunbeams, sunrise, sunset, tourism, travel, vacations, water, wide"
http://ftps1a4l1.adwitads.com/ImageBank/General/Background/11275877_xxl.eps,"alternative, antibiotic, background, blue, bokeh, capsule, care, chemistry, clinic, closeup, concept, container, cure, danger, diet, disease, doctor, drug, editable, glare, graphic, health, healthy, herbal, hospital, illustration, medical, medication, medicinal, medicine, narcotic, natural, object, pain, painkiller, pharmaceutical, pharmacy, pill, product, reflection, science, sick, sickness, sign, symbol, tablet, traditional, vitamin"
http://ftps1a4l1.adwitads.com/ImageBank/General/Background/11549910_xxl.eps,"aged, announce, background, bar, billboard, black, blackboard, board, border, bulletin, cafe, chalk, chalkboard, correction, cover, cuisine, daily, dark, decorative, design, dinner, dirty, dish, distressed, empty, frame, isolated, lunch, menu, offer, ornamental, outline, picture, plate, price, restaurant, simple, square, tavern, vertical, wall, wallpaper, white, wooden, word"
http://ftps1a4l1.adwitads.com/ImageBank/General/Background/11651000_xxl.eps,"background, banner, beach, beverage, boat, book, cafe, cartoon, cat, chair, coffee, couple, craft, cup, date, drink, fall, fence, food, frame, landscape, light, love, man, menu, mountains, nature, ocean, page, recreation, relationships, restaurant, sailboat, saucer, sea, shade, sky, street, summer, sun, symbol, table, tasty, tea, tourism, umbrella, woman"
http://ftps1a4l1.adwitads.com/ImageBank/General/Background/11837275_xxl.eps,"abstract, advertise, art, background, banner, beautiful, blue, border, brochure, bubble, card, circle, colorful, cover, creative, decoration, design, digital, document, editable, effect, fantasy, file, flyer, folder, frame, graphic, happy, illustration, leaflet, marketing, menu, modern, paper, pattern, poster, presentation, print, promotion, publication, shape, splash, style, stylish, template, transparent, water, white"
http://ftps1a4l1.adwitads.com/ImageBank/General/Background/11842075_xxl.eps,"affection, anniversary, baby, background, birthday, bowl, card, childish, concept, customizable, cute, delicate, dots, draw, emotional, event, excited, fun, girl, greetings, hanging, happy, holiday, illustration, important, invitation, joy, kid, little, love, minimalist, moment, nestling, new, nice, party, personal, play, playfulness, romantic, shower, sit, small, smile, special, specifically, star, stripes, welcome, young"
http://ftps1a4l1.adwitads.com/ImageBank/General/Background/11915014_xxl.eps,"abstract, art, artistic, backdrop, background, blue, cartoon, collection, colorful, concept, contemporary, creative, decoration, design, digital, energy, futuristic, graphic, green, grunge, illustration, image, infinity, light, melody, modern, music, musical, note, orange, pattern, poster, rainbow, random, red, repeat, screen, space, splash, technology, texture, tone, tune, wallpaper, watercolor"
http://ftps1a4l1.adwitads.com/ImageBank/General/Background/11931455_xxl.eps,"abstract, art, artistic, backdrop, background, backgrounds, banner, beautiful, blue, blurred, bright, card, color, curve, design, effect, element, energy, flow, flowing, glitter, glow, glowing, graphic, illustration, image, light, lightning, line, modern, motion, neon, night, orange, pattern, power, set, shape, shiny, soft, star, style, tentacle, texture, vibrant, wallpaper, water, wave, web"
http://ftps1a4l1.adwitads.com/ImageBank/General/Background/11996874_xxl.eps,"abstract, advertise, art, background, banner, beautiful, blue, border, brochure, business, clear, cover, decoration, design, document, editable, elegant, file, flyer, folder, frame, global, graphic, illustration, line, map, marketing, minimal, modern, newsletter, official, paper, pattern, poster, presentation, print, promotion, publication, shape, splash, style, stylish, swirl, template, transparency, transparent, wave, word"
http://ftps1a4l1.adwitads.com/ImageBank/General/Background/12223684_xxl.eps,"abstract, art, backgrounds, blank, breakfast, brown, card, circles, classic, classical, classy, damask, decoration, decorative, design, dinner, elegance, elegant, element, food, fork, gold, golden, graphics, illustration, invitation, kitchen, knife, lunch, luxury, maroon, menu, nobody, old, ornament, ornate, patterns, red, repeating, restaurant, retro, silhouette, spoon, symbol, template, texture, vintage, wallpaper"
http://ftps1a4l1.adwitads.com/ImageBank/General/Background/12230682_xxl.eps,"art, backdrop, background, banner, beautiful, billboard, black, bright, club, concert, crowd, dark, decoration, design, disco, entertainment, event, fantasy, fashion, female, flyer, fun, funky, girl, go go, graphic, illustration, invitation, light, music, musical, night, party, performance, pink, place, pop, poster, ray, rock, show, silhouette, star, template, text, transparency, transparent, wallpaper"
http://ftps1a4l1.adwitads.com/ImageBank/General/Background/12321336_xxl.eps,"abstract, art, background, banner, brochure, business, card, cheese, color, company, concept, cover, creative, design, dynamic, effective, flayer, icons, identity, illustration, label, letter, map, menu, modern, name, new, paper, pizza, red, restaurant, set, stationary, style, template, text, tomato, visual, yellow"
http://ftps1a4l1.adwitads.com/ImageBank/General/Background/12391789_xxl.eps,"abstract, animal, art, backdrop, background, banner, beautiful, beauty, brochure, bunny, card, celebration, colorful, concept, cool, copy, cute, day, decor, decoration, decorative, design, doodle, dot, drawing, easter, editable, element, family, graphic, green, greeting, happy, holiday, illustration, label, lovely, modern, pattern, postcard, presentation, rabbit, scrapbook, spring, style, symbolic, template, wallpaper, web"
http://ftps1a4l1.adwitads.com/ImageBank/General/Background/12440643_xxl.eps,"abstract, backdrop, background, beautiful, blue, brochure, business, card, colorful, concept, cover, decoration, design, digital, editable, effect, fantasy, graphic, illustration, lines, modern, pamphlet, poster, presentation, print, shape, style, stylish, template, text, transparency, transparent, wallpaper, wave, white"
http://ftps1a4l1.adwitads.com/ImageBank/General/Background/12487372_xxl.eps,"arrangement, beautiful, beauty, bloom, blossom, bouquet, buds, bunch, colorful, decoration, easter, flora, floral, flowers, fresh, gift, green, isolated, leaf, love, march, mothers, natural, nature, pink, plants, pretty, purple, red, romantic, spring, springtime, tulips, valentine"
http://ftps1a4l1.adwitads.com/ImageBank/General/Background/12808899_xxl-1.eps,"april, art, background, basket, billboard, blank, board, bunny, cartoon, character, clipart, copyspace, cute, decorated, drawing, easter, easter background, easter bunny, easter eggs, easter sign, egg, eggs, field, frame, graphic, grass, hamper, happy, holding, holiday, hunt, illustration, lawn, meadow, nature, painted, pattern, placard, plank, post, rabbit, sign, signpost, space, spring, sweet, wood, wood sign, wooden"
http://ftps1a4l1.adwitads.com/ImageBank/General/Background/12940380_xxl.eps,"abstract, art, background, beam, beauty, blur, bokeh, bright, colorful, concept, daisy, day, defocus, design, desktop, easter, effect, field, flora, flower, focus, foliage, fresh, garden, gardening, grass, green, growth, herbs, lawn, leaf, light, lush, meadow, natural, nature, park, pattern, plant, scenic, season, shiny, sky, soft, spring, summer, sun, sunny, texture, wallpaper"
http://ftps1a4l1.adwitads.com/ImageBank/General/Background/13707581_xxl.eps,"abstract, aqua, art, backdrop, background, beautiful, blue, blur, blurred, bright, bubble, celebrate, circle, clean, cold, color, colorful, cool, decoration, design, effect, elegance, focus, fresh, glow, glowing, graphic, illuminated, illustration, image, light, liquid, magic, modern, round, shape, shine, shiny, space, style, vivid, wallpaper, water, white"
http://ftps1a4l1.adwitads.com/ImageBank/General/Background/14023952_xxl.eps,"backgrounds, black, brown, business, cafe, celebrate, chocolate, cocktail, coffee, cooking, cuisine, cups, decoration, design, dining, dinner, drink, eating, food, fork, gourmet, graphic, illustration, invitation, kitchen, knife, lunch, meal, menu, old, paper, party, pattern, plate, red, restaurant, retro, set, silhouette, simplicity, spoon, striped, supper, symbol, table, tablecloth, tea, template, utensil"
http://ftps1a4l1.adwitads.com/ImageBank/General/Background/14024077_xxl.eps,"backgrounds, brown, business, cafe, celebrate, chocolate, cocktail, coffee, cooking, cuisine, cups, decoration, design, dining, dinner, drink, eating, food, fork, gourmet, graphic, illustration, invitation, kitchen, knife, lunch, meal, menu, old, paper, party, pattern, plate, restaurant, retro, set, silhouette, simplicity, spoon, striped, supper, symbol, table, tablecloth, tea, template, utensil"
http://ftps1a4l1.adwitads.com/ImageBank/General/Background/14127000_xxl.eps,"alcohol, ale, background, bar, beer, beverage, cold, design, drawing, drink, fest, festival, foam, glass, gold, golden, graphic, grunge, lager, liquid, object, october, oktoberfest, party, poster, pub, shine, text"
http://ftps1a4l1.adwitads.com/ImageBank/General/Background/14426860_xxl.eps,"abstract, advertising, art, background, birthday, blue, bright, burn, burst, card, circus, color, design, dot, energy, flare, gift, glare, glow, happy, hot, illustration, light, line, orange, radial, ray, red, retro, round, shiny, spring, star, starburst, striped, stripes, style, stylish, summer, suprise, texture, transparent, trendy, triangle, wallpaper, white, yellow"
http://ftps1a4l1.adwitads.com/ImageBank/General/Background/14445601_xxl.eps,"advertising, auto, automobile, automotive, backdrop, background, banner, best, buy, car, dealer, dealership, design, driving, exhibition, flyer, gift, hot, illustration, insurance, label, landscape, market, motor, new, orange, original, poster, price, purchase, rent, rental, repair, retail, retro, sale, service, tag, template, text, transport, transportation, travel, trip, used, vehicle, vintage, wallpaper, wheel"
http://ftps1a4l1.adwitads.com/ImageBank/General/Background/14561902_xxl.eps,"abstract, art, artistic, backdrop, background, blue, cartoon, collection, colorful, concept, contemporary, creative, decoration, design, digital, energy, futuristic, graphic, green, grunge, illustration, image, infinity, light, melody, modern, music, musical, note, orange, pattern, poster, rainbow, random, red, repeat, screen, space, technology, texture, tone, tune, wallpaper"
http://ftps1a4l1.adwitads.com/ImageBank/General/Background/14632698_xxl.eps,"abstract, ancient, aqua, art, backdrop, background, beautiful, blur, blurred, bright, brown, bubble, celebrate, circle, clean, color, colorful, cool, decoration, design, effect, elegance, focus, glow, glowing, graphic, illuminated, illustration, image, light, liquid, magic, modern, old, retro, round, shape, shine, shiny, space, style, vintage, vivid, wallpaper, water, white"
http://ftps1a4l1.adwitads.com/ImageBank/General/Background/14751474_xxl.eps,"abstract, art, autumn, backdrop, background, banner, beautiful, border, botany, branch, bright, card, color, decoration, decorative, design, element, environment, fall, floral, foliage, forest, frame, gold, illustration, leaf, light, maple, nature, october, orange, ornament, pattern, plant, red, season, september, silhouette, sky, space, summer, sun, swirl, template, texture, tree, wallpaper, woods, yellow"
http://ftps1a4l1.adwitads.com/ImageBank/General/Background/14941404_xxl.eps,"automobile, black, car, competition, contour, design, drive, fog, graphic, horizon, illustration, imprints, isolated, journey, off, outline, painting, perspective, pick, pickup, print, race, road, rubber, shape, sign, snow, speed, symbol, terrain, tire, trace, track, traction, traffic, trail, transport, transportation, turn, tyre, up, vehicle, way, wheel, white, winding"
http://ftps1a4l1.adwitads.com/ImageBank/General/Background/14956927_xxl.eps,"abstract, air, background, blue, burst, celebration, christmas, fairytale, festive, flake, flicker, glimmer, glow, holiday, illuminated, illumination, light, magic, magical, miracle, night, noel, ray, seasonal, shining, shiny, sky, snow, space, sparkling, spotlight, starry, stars, twinkling, warm, wish, wonder"
http://ftps1a4l1.adwitads.com/ImageBank/General/Background/15010196_xxl.eps,"bag, banner, bears, beautiful, beauty, business, buy, buyer, camera, cartoon, clothing, concept, conceptual, consumer, consumerism, customer, cute, drawing, dress, fashion, female, girl, handbag, happy, hat, illustration, items, journey, juggling, lifestyle, makeup, map, modern, people, polka dots, pretty, purse, retail, sale, shoes, shopping, shopping icon, shopping mall, stores, thinking, travel, vector people, young woman"
http://ftps1a4l1.adwitads.com/ImageBank/General/Background/15069694_xxl.eps,"accent, art, award, background, banner, blank, bow, cancer, caption, celebration, curled, decoration, decorative, display, elegance, element, gift, heading, illustration, image, imagery, insignia, label, line, message, modern, object, painted, paintings, paper, pennant, pink, placard, poster, red, retro, ribbon, satin, scroll, sign, sunburst, swirl, symbol, tag, tape, winner"
http://ftps1a4l1.adwitads.com/ImageBank/General/Background/15117347_xxl.eps,"backgrounds, beginnings, biker, black, car, checked, competition, competitive, computer, decoration, design, end, extreme, finishing, flag, flame, frame, fuel, gauge, icon, illustration, instrument, line, measurement, metal, meter, number, odometer, painting, panel, political, race, racing, rally, set, sign, speed, speedometer, sports, stick, stopwatch, symbol, time, trophy, venue, wallpaper, watch, waving, white"
http://ftps1a4l1.adwitads.com/ImageBank/General/Background/15176439_xxl.eps,"background, ball, bright, burst, celebration, circle, club, clubbing, dance, decoration, design, disco, discotheque, element, entertainment, equipment, explosion, flashy, fun, glass, glitter, glittery, glow, green, illustration, light, mirror, mirrored, music, night, nightclub, nightlife, ornament, party, ray, reflect, reflection, retro, round, seventies, shape, shine, shiny, sparkle, sphere, spin, spot, spotlight, star, yellow"
http://ftps1a4l1.adwitads.com/ImageBank/General/Background/15271908_xxl.eps,"art, background, barbecue, bbq, beef, card, classic, cook, cooking, cover, creative, decorate, decoration, delivery, design, dinner, fastfood, fat, fire, food, fried, gourmet, graphic, grill, grilled, hot, illustration, invitation, kebab, kitchen, label, list, lunch, meal, meat, menu, party, picnic, pork, poster, prepared, restaurant, roast, roasted, sign, steak, symbol, tasty, template"
http://ftps1a4l1.adwitads.com/ImageBank/General/Background/15596254_xxl.eps,"advertising, alcohol, antique, aristocratically, background, book, boutique, branch, brochure, card, classical, cover, damaged, decorating, design, drink, elite, engraving, food, france, french, gold, grade, grape, grapevine, graphic, illustration, invitation, italian, label, limited, list, mark, menu, noble, packaging, packing, product, release, retro, rusted, style, sustained, symbol, tasting, template, traditional, vintage, wine"
http://ftps1a4l1.adwitads.com/ImageBank/General/Background/15609730_xxl.eps,"advertise, arts, backdrop, background, banners, blank, business, buttons, car, card, chrome, collection, cover, decorative, design, discount, elegant, element, glossy, header, heavy, hot, illustration, industry, internet, iron, label, layout, message, metal, metallic, modern, navigation, pattern, red, retail, set, silver, speed, stainless, steel, style, technology, template, theme, trendy, website"
http://ftps1a4l1.adwitads.com/ImageBank/General/Background/15796540_xxl.eps,"abstract, advertise, background, banner, blue, border, box, brochure, business, businessman, businesswoman, character, decoration, design, document, editable, female, figure, file, fold, folder, frame, girl, global, graphic, illustration, line, man, marketing, modern, newsletter, official, paper, people, point, poster, presentation, print, professional, promotion, publication, template, text, tri fold, wave, word, work, worker"
http://ftps1a4l1.adwitads.com/ImageBank/General/Background/16024301_xxl.eps,"abstract, backdrop, background, ball, banner, black, bow, bright, card, celebration, christmas, concept, cover, creative, cut, decoration, gift, glow, green, greeting, happy, holiday, illustration, light, merry, merry christmas, new, new year, ornament, paper, postcard, present, presentation, red, ribbon, shape, star, sticker, style, surprise, template, wallpaper, web, white, winter, xmas, year"
http://ftps1a4l1.adwitads.com/ImageBank/General/Background/16631937_xxl.eps,"abstract, attractive, banner, beautiful, celebration, club, club party, clubbing, concert, cool, crazy, crowd, culture, dance, dancer, dancing people, dating, disco, discotheque, dj, eve, event, fashion, festival, festival crowd, festival stage, friends, fun, laughing, lifestyle, modern, motion, music, music background, music festival, new, night, nightclub, nightlife, party, people, rock, screaming, show, silhouette, smiling, sound, teen, year, young"
http://ftps1a4l1.adwitads.com/ImageBank/General/Background/16904498_xxl.eps,"abstract, abstraction, ad, background, banner, blue, brochure, color, colorful, company, corporate, cover, design, digital, folder, gradient, graphic, green, illustration, layout, magazine, marketing, modern, multicolor, orange, page, poster, print, purple, template"
http://ftps1a4l1.adwitads.com/ImageBank/General/Background/17290318_xxl.eps,"advertising, banner, box, bubble, business, card, chat, clean, collection, communicate, communication, dialog, empty, frame, free, green, happy, icon, isolated, item, label, memories, message, note, paper, promotion, rectangle, red, sale, scrapbook, set, shape, sign, space, special, speech, sticker, store, story, strip, style, symbol, template, text, tweet, web, website, www"
http://ftps1a4l1.adwitads.com/ImageBank/General/Background/17315537_xxl.eps,"access, authentication, authorization, background, badge, banner, blank, board, business, button, checked, corporate, element, form, hanging, hung, identification, identity, illustration, info, interface, isolated, layout, material, member, metal, mobile, paper, pass, password, pattern, placard, plank, plastic, realistic, rope, security, sign, signboard, site, string, tablet, template, texture, user, web, wood, wooden"
