URL,Keywords
http://ftps1a4l1.adwitads.com/ImageBank/Fewer Industries/8871916_xxl.jpg,"barrel, blue, business, cloud, color, concept, construction, day, desert, drill, drilling, ecology, energy, environment, equipment, exploration, extraction, fuel, gas, gasoline, industry, lever, metal, mining, nobody, oil, oil field, outdoor, overcast, pipe, pipeline, pollution, power, pump, rig, russia, sand, scene, scenic, siberia, sky, steel, technology, transfer, valve, wealth, weather, well, wind, work"
http://ftps1a4l1.adwitads.com/ImageBank/Financial Services/Accounting/11622517_xxl.jpg,"accountant, blue, bookkeeper, bookkeeping, boss, business, businessman, calculator, caucasian, commerce, company, director, document, female, fill, form, hand, human, job, lady, manager, mature, middle, office, paper, pen, people, person, place, principal, professional, table, white, woman, work, worker, workplace, write"
http://ftps1a4l1.adwitads.com/ImageBank/Financial Services/Accounting/6537632_xxl.jpg,"account, accountant, accounting, balance, ballpoint, bank, banking, briefcase, budget, buisness, business, calculate, calculator, chart, checking, counting, credit, diagram, earning, exel, expenses, finance, financial, fountain, graph, home, maths, money, number, office, paper, paperwork, payment, pen, pricelist, printout, profit, report, sale, spreadsheet, statement, statistics, success, tax, wallet"
http://ftps1a4l1.adwitads.com/ImageBank/Financial Services/Accounting/7853438_xxl.jpg,"accountant, adviser, american, bill, bills, bookkeeper, budget, business, calculate, calculator, credit, deduction, deposit, digital, electronic, envelop, file, fill, filling, finance, finances, financial, fiscal, form, government, hand, hands, human, individual, irs, lady, letter, office, pen, people, person, receipt, refund, return, staff, table, tax, taxpayer, white, woman, worker, write, writing, year"
http://ftps1a4l1.adwitads.com/ImageBank/Financial Services/Banking/146755083.jpg,
http://ftps1a4l1.adwitads.com/ImageBank/Financial Services/Banking/3295217_med.jpg,"advice, advising, advisor, attorney, business, businesswoman, caucasian, client, conference, consultant, consultation, conversation, counseling, couple, deal, document, elderly, estate, expert, explaining, financial, future, guidance, home, husband, indoors, insurance, investment, legal, mature, meeting, paperwork, personal, planner, planning, plans, preparation, real, reliability, responsibility, retirement, sales, selling, senior, strategy, tax, trust, wife, will"
http://ftps1a4l1.adwitads.com/ImageBank/Financial Services/Banking/5120530_xxl.jpg,"adult, affection, attractive, bank, beautiful, beauty, blue jeans, bond, brown eyes, brown hair, brunette, casual clothing, caucasian, cheerful, couple, credit, cute, diverse, female, gorgeous, handsome, happiness, happy, husband, joy, love, midlife, money, partners, people, save, savings, smile, smiling, stand, standing, thirties, togetherness, twenties, two, upright, vertical, white, wife, woman"
http://ftps1a4l1.adwitads.com/ImageBank/Financial Services/Tax/100522270.jpg,
http://ftps1a4l1.adwitads.com/ImageBank/Financial Services/Tax/158189342.jpg,
http://ftps1a4l1.adwitads.com/ImageBank/Financial Services/Tax/18724341_xxl.jpg,
http://ftps1a4l1.adwitads.com/ImageBank/Financial Services/Tax/18737517_xxl.jpg,
http://ftps1a4l1.adwitads.com/ImageBank/Financial Services/Tax/6537632_xxl.jpg,
http://ftps1a4l1.adwitads.com/ImageBank/Food/BBQ/13812639_l.jpg,"barbecue, barbecuing, barbeque, barbequing, bbq, beef, black, burgers, burn, charcoal, closeup, cook, cooking, cookout, diet, dining, dinner, eat, fire, flame, food, fresh, fried, garden, good, gourmet, green, grid, grill, grilled, grilling, heat, hot, meal, meat, nobody, outdoor, outside, party, pepper, protein, red, roast, skewers, smoke, steak, summer, weather, white"
http://ftps1a4l1.adwitads.com/ImageBank/Food/BBQ/14941193_xxl.jpg,"appetizer, assortment, barbecue, bbq, bite sized, blue, bread, bun, cheese, chips, closeup, cooked, cuisine, dinner, fast food, food, food and drink, lunch, meal, meat, miniature, munchie, nobody, pile, plate, platter, pork, potato chips, pulled, pulled pork, recipe, sandwich, sauce, savoury, selective focus, shredded, slider, small, still life, table, table setting, take out, three"
http://ftps1a4l1.adwitads.com/ImageBank/Food/BBQ/6260302_xl.jpg,"appetizers, barbecue, bbq, beef, bell, broiled, chicken, condiments, delicious, dinner, dish, eat, fresh, grill, hot, juicy, lunch, meat, onions, pepper, peppers, pieces, prepared, shish kabob, sizzle, skewers, spices, tasty, veggies"
http://ftps1a4l1.adwitads.com/ImageBank/Food/BBQ/9524506_xxl.jpg,"barbecue, bbq, beef, charcoal, cooking, fire, flame, food, franks, grilled, hamburgers, hot dogs, meat, pork, wieners"
http://ftps1a4l1.adwitads.com/ImageBank/Food/Breakfast ? Fastfood/10121245_xxl.jpg,"berries, berry, closeup, crepe, daylight, dessert, detail, dinner, fill, filled, food, fruit, fruits, fruity, gourmet, lunch, meal, nutrition, omelette, pancake, pancakes, served, snack, strawberries, strawberry, stuffing, sweet, tasty"
http://ftps1a4l1.adwitads.com/ImageBank/Food/Breakfast ? Fastfood/10121250_xxl.jpg,"berries, berry, closeup, crepe, custard, daylight, dessert, detail, dinner, fill, filled, food, fruit, fruits, fruity, gourmet, lunch, meal, nutrition, omelette, pancake, pancakes, sauce, served, snack, strawberries, strawberry, stuffing, sweet, tasty, vanilla"
http://ftps1a4l1.adwitads.com/ImageBank/Food/Breakfast ? Fastfood/12455408_xxl.jpg,"baked, breakfast, cake, chocolate, closeup, coffee, cream, cup, delicious, dessert, dinner, dish, eat, food, gourmet, morning, pastry, pie, snack, sweet, table, tart, tasty, whipped"
http://ftps1a4l1.adwitads.com/ImageBank/Food/Breakfast ? Fastfood/12854009_xxl.jpg,"appetizer, background, baked, barbecue, basil, closeup, cooked, cooking, cuisine, culinary, delicious, diet, dining, dinner, dish, eat, fillet, fish, food, fresh, fried, gourmet, green, grill, grilled, healthy, hot, isolated, leaf, lunch, meal, meat, mushroom, nutrition, pepper, plate, prepared, red, roasted, salad, sauce, seafood, slice, steak, studio, table, tasty, tomato, vegetable, white"
http://ftps1a4l1.adwitads.com/ImageBank/Food/Breakfast ? Fastfood/12985812_ml.jpg,"bacon, closeup, crispy, cured, fattening, food, fried, group, meat, pork, rashers, roasted, slices, streaky, strips, studio, tasty, thin"
http://ftps1a4l1.adwitads.com/ImageBank/Food/Breakfast ? Fastfood/13275905_xxl.jpg,
http://ftps1a4l1.adwitads.com/ImageBank/Food/Breakfast ? Fastfood/17993623_xxl.jpg,"appetizer, background, bacon, bean, beans, bistro, bread, breakfast, close up, closeup, crispy, dish, egg, eggs, english, european, fat, food, french, fried, greasy, ham, horizontal, lettuce, lunch, meal, meat, morning, plate, pork, portion, restaurant, roast, roasted, salad, sandwich, sausage, sausages, slice, starter, strips, toast, toasted, toasts, tomato, tomatoes, vegetable, white, yellow, yolk"
http://ftps1a4l1.adwitads.com/ImageBank/Food/Breakfast ? Fastfood/20972520_xxl.jpg,"american, beans, beef, cheddar, cheese, cheesy, chili, chilli, chips, fast, fattening, food, french, fried, fries, fry, hearty, lunch, meal, meat, melted, messy, onions, potato, potatoes, salty, sauce, snack, spicy, unhealthy, vegetables"
http://ftps1a4l1.adwitads.com/ImageBank/Food/Breakfast ? Fastfood/23439863_xxl.jpg,"afternoon tea, apfelstrudel, apple, apple strudel, austrian cuisine, baked, bavaria, breakfast, cake, cider, cinnamon, closeup, cook, cooking, crisp, delicious, dessert, europe, filling, focus, food, fruit, homemade, icing sugar, isolated on white, layered, pastries, pie, pieces, portion, prepare, raisins, recipe, roll, slices, spicy, stroodle, strudel, studio, sugar, sweet, tasty, tasty dish traditional, teatime, treat, two, typically, whole, yeast"
http://ftps1a4l1.adwitads.com/ImageBank/Food/Breakfast ? Fastfood/23920603_xxl.jpg,"baked, biscuits, breakfast, buttermilk, closeup, comfort food, country, food, fresh, gravy, homemade, horizontal, meal, pepper, rustic, sourdough, southern food, table, wood"
http://ftps1a4l1.adwitads.com/ImageBank/Food/Breakfast ? Fastfood/272264_med.jpg,
http://ftps1a4l1.adwitads.com/ImageBank/Food/Breakfast ? Fastfood/3069603_xxl.jpg,"accommodation, bed, bedroom, beige, beverage, breakfast, coffee, continental, cozy, croissant, croissants, cup, decor, decoration, design, drink, floral, flowers, food, fresh, furnishings, furniture, home, hotel, house, inside, juice, linens, living, luxury, meal, morning, orange, plate, relaxing, residence, residential, resort, room, saucer, serve, served, service, travel, traveling, tray, upscale, vase, white"
http://ftps1a4l1.adwitads.com/ImageBank/Food/Breakfast ? Fastfood/3245450_med.jpg,"background, bowl, chip, chips, food, fried, heap, isolated, potato, snack, unhealthy eating, white"
http://ftps1a4l1.adwitads.com/ImageBank/Food/Breakfast ? Fastfood/3600008_xxl.jpg,"american food, black olives, brunch, caucasian, cheese, condiment, cookery, cooking, cucumber, dairy, dairy product, deli, diner, early forties, food, forties, ham, ingredient, lettuce, lifestyle, lunch, male, man, mature adult, mayo, mayonnaise, meal, meat, mid life, mustard, napkin, north american food, north american foods, olive, one man, one person, onion, pastrami, pork, produce, recipe, red onion, sandwich, sweet corn, take away, tortilla, tortilla wrap, wrap"
http://ftps1a4l1.adwitads.com/ImageBank/Food/Breakfast ? Fastfood/4469782_xl.jpg,"breakfast, cholesterol, color, cook, cooking, culinary, delicious, diet, eat, egg, food, fresh, fry, fryer, grease, health, healthy, heat, hot, ingredients, kitchen, lunch, macro, nutrition, protein, skillet, vegetable, yellow"
http://ftps1a4l1.adwitads.com/ImageBank/Food/Breakfast ? Fastfood/8696240_xxl.jpg,"eggy bread, french toast, appetizer, bread, breakfast, closeup, cooked, food, fried, fried bread, lunch, meatless, nobody, parsley, plate, snack, supper, toast, toasted bread, white bread"
http://ftps1a4l1.adwitads.com/ImageBank/Food/Breakfast ? Fastfood/9170740_m.jpg,"bread, bun, catfish, coleslaw, dinner, fillet, fish, food, french fries, fried, fries, lunch, meal, meat, plate, potato, sandwich, seafood, white meat"
http://ftps1a4l1.adwitads.com/ImageBank/Food/Breakfast ? Fastfood/9600489_xxl.jpg,"appetizer, asia, asian, bean, choice, cholesterol, cooking, cuisine, delicious, dinner, dish, egg, fast, food, fresh, fried, green, king, lemon, lime, lunch, market, meal, noodle, pad, peanut, plate, quick, red, serving, sprouts, stir, tasty, thai, thailand, thin, traditional, unhealthy, variety, vegetable, vegetarian, white, yummy"
http://ftps1a4l1.adwitads.com/ImageBank/Food/Breakfast ? Fastfood/9689896_xxl.jpg,"assortment, background, biscuit, breakfast, brown, browned, close up, delicious, different, dinner, diversity, food, foodstuffs, france, freshness, gold, gourmet, group, healthy, labneh, lebanese, manakish, meal, objects, studio, tasty, traditional, veggies, warm, zaatar"
http://ftps1a4l1.adwitads.com/ImageBank/Food/Breakfast ? Fastfood/9860415_xxl.jpg,"asparagus, breakfast, canadian bacon, cuisine, dairy, delicious, eggs benedict, english muffin, food, hollandaise sauce, orange juice, parsley, poached eggs, rich, vegetable"
http://ftps1a4l1.adwitads.com/ImageBank/Food/Burger/10278332_ml.jpg,"american, background, barbecue, beef, big, bread, bun, burger, cheese, cheeseburger, classic, closeup, cooked, cuisine, delicious, diet, dinner, double, eating, fast, fastfood, fat, food, fresh, grilled, hamburger, isolated, juicy, junk, large, lettuce, lunch, meal, meat, nutrition, object, onion, picnic, salad, sandwich, seed, sesame, single, snack, tasty, tomato, unhealthy, vegetable, white"
http://ftps1a4l1.adwitads.com/ImageBank/Food/Burger/11219651_xl.jpg,"board, bread, bun, burger, cheese, cheeseburger, eat, eating, fast, focus, food, gourmet, hamburger, image, lettuce, meal, meat, nobody, onion, papper, paprika, pickle, ready, rustic, sandwich, sauce, sausage, seeds, selective, sesame, side, snack, table, tomato, unhealthy, vegetables, vertical"
http://ftps1a4l1.adwitads.com/ImageBank/Food/Burger/12320878_xxl.jpg,"american, barbecue, beef, beefsteak, bread, bun, burger, cheddar, cheese, cheeseburger, cooked, fast food, fastfood, food, french fries, fried, hamburger, isolated, ketchup, meal, meat, restaurant, salad, sandwich, sauce, snack, steak, studio shot, tomato, unhealthy, white background"
http://ftps1a4l1.adwitads.com/ImageBank/Food/Burger/12769290_xxl.jpg,"american, background, bar, barbecue, beef, beverage, big, bread, bun, burger, cheese, cheeseburger, classic, cola, cuisine, dinner, drink, eating, fast, fat, food, french, fried, fries, gourmet, grilled, hamburger, ice, isolated, junk, ketchup, lettuce, lunch, meal, meat, nobody, object, onion, potato, red, refreshment, sandwich, sesame, snack, soda, steak, tomato, unhealthy, vegetable, white"
http://ftps1a4l1.adwitads.com/ImageBank/Food/Burger/12772736_xxl.jpg,"american, background, beef, big, bread, bun, burger, cheddar, cheese, cheeseburger, classic, closeup, colorful, cuisine, delicious, diet, eating, fast, fat, food, fresh, grilled, hamburger, isolated, lettuce, macro, meal, meat, nutrition, object, salad, sandwich, seed, sesame, shot, single, snack, studio, tasty, tomato, unhealthy, white"
http://ftps1a4l1.adwitads.com/ImageBank/Food/Burger/13484547_xl.jpg,"background, big, blondy, breakfast, burger, carbohydrate, caucasian, cheeseburger, child, eat, fast, fastfood, food, girl, hamburger, happy, hungry, isolated, junk, junkfood, kid, laughing, lunch, meal, nutrient, nutrition, people, person, pink, portrait, sandwich, smile, teen, teenager, unhealthy, white, young, youth health"
http://ftps1a4l1.adwitads.com/ImageBank/Food/Burger/14768569_xxl.jpg,"american, bar, beef, bread, brown, bun, burger, cheese, cheeseburger, classic, cuisine, cut, eating, fast, fast food, fat, food, fried, gourmet, green, grilled, hamburger, leaf, lettuce, lunch, meal, meat, nobody, object, red, refreshment, sandwich, sesame, snack, steak, tomato, unhealthy, vegetable, yellow"
http://ftps1a4l1.adwitads.com/ImageBank/Food/Burger/18812142_xl.jpg,"american, background, barbecue, bbq, beef, board, bread, bun, burger, closeup, cooked, cuisine, delicious, dinner, food, gourmet, green, grilled, hamburger, juicy, lettuce, lunch, meal, meat, nobody, onion, pork, ready to eat, red, sandwich, sauce, selective focus, snack, tomato, vegetable"
http://ftps1a4l1.adwitads.com/ImageBank/Food/Burger/22306375_xxl.jpg,"american cuisine, burger, cheeseburger, cola, delicious, dinner, drink, fast food, french fries, hamburger, junk food, meal, menu, potatoes, restaurant, sandwich, soft, still life, tasty"
http://ftps1a4l1.adwitads.com/ImageBank/Food/Burger/3018391_mega.jpg,"american, background, beef, big, bread, breakfast, burger, cafe, calories, cheese, cheeseburger, collage, cooked, cooking, culture, delicious, diner, dish, eating, fast, fastfood, fattening, fatty, fish, food, french, fresh, fry, hamburger, health, healthy, lettuce, lunch, meal, menu, nutrition, onion, picnic, pizza, plate, potato, prepared, restaurant, salad, sandwich, served, snack, unhealthy, vegetables, white"
http://ftps1a4l1.adwitads.com/ImageBank/Food/Burger/4434137_xxl.jpg,"american, beefburger, bread, bun, burger, cheese, cheeseburger, diner, fast foot, fastfood, fatty, food, grande, hamburger, large, lettuce, mayo, mayonnaise, meal, onion, pickle, relish, restaurant, roll, sauce, seed, sesame, slice, sliced, slices, table, take away, takeaway, tomato, unhealthy, white, white background"
http://ftps1a4l1.adwitads.com/ImageBank/Food/Burger/5411840_xl.jpg,"beef, bread, brown, bun, burger, cheddar, cheese, cheeseburger, classic, closeup, color, colorful, cooked, cuisine, delicious, diet, diner, dinner, eating, fast, fat, food, fresh, grilled"
http://ftps1a4l1.adwitads.com/ImageBank/Food/Burger/7638292_xxl.jpg,"background, bread, buns, cheese, cheeseburgers, chive, fat, food, fresh, freshness, hamburgers, isolated, junk, lettuce, meat, pair, pile, prepared, rolls, slice, stacked, tomatoes, two, vegetables, white"
http://ftps1a4l1.adwitads.com/ImageBank/Food/Burger/8750244_xl.jpg,"addictive, alcohol, amber, american, anything, background, bar, barbecue, baseball, baseball glove, bbq, beef, beer, beverage, black, bread, bright, brown, bun, business, char broiled, cheddar cheese, cheeseburger, colorful, conceptual, contrast, copy space, delicious, delightful, diet, diner, drink, eating, fast food, food, fresh, frosty, glass, green, grilled, hamburger, lettuce, light, line, lunch, modern, nutrition, onion, pattern, patty, peanuts, red, reflection, sandwich, shadow, shape, snack, sports, sports bar, sweet, symbol, takeout, tasty, texture, tomato, unhealthy, white, wood"
http://ftps1a4l1.adwitads.com/ImageBank/Food/Burger/9231012_xl.jpg,"american, background, barbecue, beef, big, bread, bun, burger, cheese, cheeseburger, classic, closeup, cooked, cuisine, delicious, diet, dinner, double, eating, fast, fastfood, fat, food, fresh, grilled, hamburger, isolated, juicy, junk, large, lettuce, lunch, meal, meat, nutrition, object, onion, picnic, salad, sandwich, seed, sesame, single, snack, tasty, tomato, unhealthy, vegetable, white"
http://ftps1a4l1.adwitads.com/ImageBank/Food/Burger/9231199_xl.jpg,"american, background, barbecue, beef, big, black, bread, bun, burger, cheese, cheeseburger, classic, closeup, cooked, cuisine, delicious, diet, dinner, double, eating, fast, fastfood, fat, food, fresh, grilled, hamburger, isolated, juicy, junk, large, lettuce, lunch, meal, meat, nutrition, object, onion, picnic, salad, sandwich, seed, sesame, single, snack, tasty, tomato, unhealthy, vegetable, white"
http://ftps1a4l1.adwitads.com/ImageBank/Food/Burger/9352486_xl.jpg,"american, bar, barbecue, beef, beverage, bread, brown, bun, burger, cheese, cheeseburger, classic, cola, cuisine, cut, drink, eating, fast, fast food, fat, food, french fries, fried, gourmet, green, grilled, hamburger, leaf, lettuce, lunch, meal, meat, nobody, object, potato, red, refreshment, sandwich, sesame, snack, steak, unhealthy, vegetable, yellow"
http://ftps1a4l1.adwitads.com/ImageBank/Food/Cake ? Bakary/10182188_xxl.jpg,"arranged, assortment, background, baked, baker, bakery, bread, breakfast, buns, caraway, closeup, display, donuts, flour, food, fresh, goods, grain, grocery, kaiser, loaves, market, pastry, poppy, products, rolls, salty, seed, slices, staple, still, variety, wheat, white, whole, wholemeal"
http://ftps1a4l1.adwitads.com/ImageBank/Food/Cake ? Bakary/10845999_xl.jpg,"berry, biscuit, breakfast, cake, cherry, cream, crust, dessert, food, fruit, gourmet, pastry, raspberry, snack, strawberry, sweet, yellow"
http://ftps1a4l1.adwitads.com/ImageBank/Food/Cake ? Bakary/11764946_xxl.jpg,"assortment, background, bake, baked, bakery, biscuit, bread, breakfast, brown, bun, cake, close up, cookies, crunchy, crust, delicious, dessert, dinner, dough, eat, eating, food, french, fresh, fried, glazed, gold, gourmet, group, healthy, hot, icing, isolated, loaf, lunch, meal, objects, pastry, pasty, photo, pie, roll, snack, sugar, sweet, tasty, traditional, variety, warm, white"
http://ftps1a4l1.adwitads.com/ImageBank/Food/Cake ? Bakary/14507825_xxl.jpg,
http://ftps1a4l1.adwitads.com/ImageBank/Food/Cake ? Bakary/166767195.jpg,
http://ftps1a4l1.adwitads.com/ImageBank/Food/Cake ? Bakary/18991389_xxl.jpg,"apple, apple pie, background, bake, baked, breakfast, cake, cinnamon, cook, cooked, crust, cuisine, culinary, dessert, diet, food, fresh, fruit, gourmet, healthy, holiday, home, isolated, nutrition, pastry, pie, puff, sweet, tart, tradition, white"
http://ftps1a4l1.adwitads.com/ImageBank/Food/Cake ? Bakary/20287099_xxl.jpg,"apple, apples, brown, candy, candy apple, caramel, caramel apple, chocolate, dessert, desserts, food, fruit, fudge apple, ingredient, malus, nuts, snack, sugar, sweet, sweetener, sweets, taffy, taffy apple, toffee, toffee apple, treat, white"
http://ftps1a4l1.adwitads.com/ImageBank/Food/Cake ? Bakary/20971692_xl.jpg,"background, baked, big, birthday, brown, cafe, cake, chocolate, coated, cookie, cream, creamy, dark, decoration, decorative, delicacy, delicatessen, delicious, desert, dessert, dish, eat, elegance, food, fresh, freshness, gift, gourmet, isolated, luxury, macro, party, pie, piece, plate, restaurant, romantic, round, satisfaction, sauce, slice, small, snack, sugar, sweet, tasty, temptation, treat, vintage, white"
http://ftps1a4l1.adwitads.com/ImageBank/Food/Cake ? Bakary/2101427_high.jpg,"anniversary, bake, baked, baking, birthday, brownies, butter, cake, catering, celebration, chocolate, confection, confectionery, course, delight, dessert, diet, dinner, edible, enjoyment, festive, final, food, frosting, gift, goods, happy, health, holiday, icing, joy, lava, lit, nana, party, plates, pleasure, presents, pudding, recipe, rich, slab, slice, snack, sugar, sweet, trays, vanilla, wedding, weight, yellow"
http://ftps1a4l1.adwitads.com/ImageBank/Food/Cake ? Bakary/2283263_mega.jpg,
http://ftps1a4l1.adwitads.com/ImageBank/Food/Cake ? Bakary/3181247_mega.jpg,"blur, blurred, bread, bread sticks, close up, close ups, closeup, closeups, crisp, detail view, detail views, detailed view, detailed views, differential focus, food and drink series, grissini, italian, no people, selective focus, snack, studio, studio shot, studio shots, vertical"
http://ftps1a4l1.adwitads.com/ImageBank/Food/Cake ? Bakary/3645134_mega.jpg,"baked, baking goods, black, cake, chocolate, colorful, cream, cupcake, cupcakes, dessert, food, halloween, holiday, icing, mini, muffin, october, orange, scary, seasonal, snack, spider, spooky, sweet, sweets, web"
http://ftps1a4l1.adwitads.com/ImageBank/Food/Cake ? Bakary/3847071_high.jpg,"baked, biscuit, biscuits, bread, celebration, cheerful, christmas, confection, confectionery, cookie, cookies, decorated, decoration, decorative, delicious, dessert, detail, festive, food, frosting, ginger, gingerbread, heart, holiday, holidays, homemade, icing, indulgence, isolated, macro, noel, ornament, present, season, seasonal, star, still, sugar, sweet, tasty, temptation, tradition, traditional, treat, walnuts, winter, xmas, yummy"
http://ftps1a4l1.adwitads.com/ImageBank/Food/Cake ? Bakary/523884_mega.jpg,"bake, bakery, baking, brunch, buffet, butter, cakes, calories, cook, cooking, cream, creamy, cuisine, culinary, delicious, dessert, dinner, dish, eat, eating, elegant, entertaining, fattening, flavor, food, fresh, fruit, glass, glassware, golden, gooey, household items, italian, italy, kitchen, lunch, luscious, messy, milk, nourishment, pastry, placemat, plate, powdered sugar, red, restaurant, rich, ripe, strawberry, sugar, sweet, tablescape, tableware, tasty, vanilla, whipped cream, yummy"
http://ftps1a4l1.adwitads.com/ImageBank/Food/Cake ? Bakary/5441674_xxl.jpg,"appetizer, baked, bread, breadstick, caraway, closeup, crisp, crunchy, flavor, flavored, group, homemade, horizontal, junk food, party, puff pastry, refreshment, salt, salted, savory, seeds, snack, stick, treat, unhealthy"
http://ftps1a4l1.adwitads.com/ImageBank/Food/Chicken/10413607_xxl.jpg,"appetizer, baked, carrot, casserole, chicken, cooked, cream, crust, delicious, dinner, dish, filo, food, gourmet, gratin, green, green pea, healthy eating, meal, meat, mustard, napkin, nobody, pastry, pea, pie, pot, poultry, prepared, savoury, selective focus, turkey, vegetable, vertical, yellow"
http://ftps1a4l1.adwitads.com/ImageBank/Food/Chicken/1066084_med.jpg,"boiled potato, brussels, brussels sprouts, carrot, christmas, christmas dinner, dinner, easter, festive dinner, gold, gravy, isolated, lettuce, meal, plate, potato, roast, roast potato, roast turkey, silver, sprouts, stuffing, thanksgiving, tomato, tray, turkey"
http://ftps1a4l1.adwitads.com/ImageBank/Food/Chicken/10818389_xxl.jpg,"appetizing, chicken, crispy, cutout, food, golden, grilled, herb, isolated, lemon, meat, plate, poultry, roast, roasted, seasoned, skin, tasty, white background, whole"
http://ftps1a4l1.adwitads.com/ImageBank/Food/Chicken/12624644_xxl.jpg,"appetizer, background, bakes, bar, barbecue, barbeque, basted, bbq, broiled, cayenne, celery, chicken, cuisine, delicious, dinner, dip, eat, fast, food, fresh, fried, grill, hot, legs, marinated, meal, meat, nutrition, over, plate, poultry, roast, salad, sauce, snack, spicy, sticks, tasty, thai, thailand, unhealthy, vegetable, white, wings"
http://ftps1a4l1.adwitads.com/ImageBank/Food/Chicken/12872321_xxl.jpg,"bacon, basil, breakfast, brunch, cheese, closeup, cooked, cuisine, delicious, dinner, dish, egg, filled, folded, food, fresh, fried, garnish, garnished, green, ham, healthy, herb, hungry, isolated, italian, lunch, macro, meal, meat, morning, nobody, omelet, omelette, omlette, onions, parsley, plate, pork, red, sauce, sausage, stuffed, toast, tomato, tortilla, vegetable, white, whole, yellow"
http://ftps1a4l1.adwitads.com/ImageBank/Food/Chicken/131932963.jpg,
http://ftps1a4l1.adwitads.com/ImageBank/Food/Chicken/13632092_xxl.jpg,"american, barbecue, barbeque, bbq, beauty, black, chicken, chinese, color, cook, cooking, cuisine, delicious, diet, dining, dinner, eat, fat, fire, flame, food, fresh, garden, gourmet, green, grill, grilled, health, healthy, home, hot, isolated, kitchen, light, living, lunch, meat, orange, outdoor, party, pepper, pork, red, restaurant, roast, summer, tasty, vegetables, white"
http://ftps1a4l1.adwitads.com/ImageBank/Food/Chicken/14971918_xxl.jpg,"apples, baked, brussels sprouts, candle, celebration, close up, cooked, cranberry, decoration, delicious, dinner, drinks, fall, flowers, food, fruits, garnished, glasses, gourmet, grapes, gravy, holiday, horn, meal, meat, nobody, organic, parsley, plenty, poultry, pumpkins, red, roast, roasted, rosemary, season, stuffing, thanksgiving, traditional, tray, turkey, turkeys, vegetables, wine"
