URL,Keywords
http://ftps1a4l1.adwitads.com/ImageBank/Conceptual/12984419_xl.jpg,"achievement, active, adventure, altitude, cliff, climb, climber, cloud, dawn, energy, extreme, free, freedom, hand, happy, healthy, heaven, high, hill, joy, landscape, lifestyle, male, men, mountain, mountaineering, nature, outdoor, peak, person, power, rock, silhouette, sky, skyline, sport, stand, stone, strength, success, summit, sun, sunlight, sunrise, top, travel, up, victory, view"
http://ftps1a4l1.adwitads.com/ImageBank/Conceptual/13196097_xxl.jpg,"amnesia, assistance, background, bow, business, careless, closeup, concentration, concept, confusion, contemplation, decisions, disease, finger, finger bow, forget, girl, hand, help, idea, index, inspiration, isolated, lost, macro, memory, motivation, people, person, plan, red, remind, reminder, reminder concept, responsibility, ribbon, sayings, sign, solution, string, success, symbol, thinking, tied, uncertainty, up, white, woman"
http://ftps1a4l1.adwitads.com/ImageBank/Conceptual/13529241_xxl.jpg,"background, bank, blue, concept, conceptual, drop, drops, ecology, environment, environmental, isolated, on white, over white, piggy, piggybank, recycling, save, saving, splash, water, white"
http://ftps1a4l1.adwitads.com/ImageBank/Conceptual/13857239_xxl.jpg,"ahead, background, beware, caution, construction, construction site, danger, diamond, isolated, isolated on white, men, men at work, men working, red, road, road sign, sign, signage, site, triangle, under, under construction, warning, warning sign, white, white background, work, working, yellow"
http://ftps1a4l1.adwitads.com/ImageBank/Conceptual/15045203_xl.jpg,"blue, brave, business, businessman, career, caucasian, change, chest, clothes, clothing, concept, confident, costume, courage, force, guy, help, hero, identity, male, man, metaphor, motivation, person, power, powerful, pride, sky, strong, success, suit, super, superhero, superman, world, young"
http://ftps1a4l1.adwitads.com/ImageBank/Conceptual/1533745_xl.jpg,"agitation, alarm, alert, drowning, finger, hand, help, pool, signal, sos, victim, water"
http://ftps1a4l1.adwitads.com/ImageBank/Conceptual/1543545_xl.jpg,"artist, boy, brick, bright, build, building, chair, chalk, child, childhood, children, concept, conceptual, daydream, destinations, drawing, dream, expectation, fantasy, future, happy, holiday, home, idea, joyful, looking, male, new, outdoor, painting, people, plans, rays, real estate, red, relaxing, residence, residential, resting, serene, sitting, sun, sunlight, sunny, travel, vacation, wall, window, yellow, young"
http://ftps1a4l1.adwitads.com/ImageBank/Conceptual/15511177_xl.jpg,"building, business, businessman, chain, character, communication, connection, cooperation, development, different, figure, game, guy, help, human, icon, idea, illustration, important, jigsaw, job, join, ladder, leader, link, man, merge, metaphor, occupation, opportunity, part, partner, partnership, people, person, piece, professional, protect, protection, puzzle, service, solution, success, symbol, team, teamwork, tie, white, win, work"
http://ftps1a4l1.adwitads.com/ImageBank/Conceptual/15824014_xxl.jpg,"anniversary, baby, birthday, box, celebration, child, christmas, close up, congratulation, daughter, decoration, decorative, deliver, festive, gesture, gift, giving, gold, hands, holding, holiday, infant, isolated, kid, little, new, present, receiving, santa, seasonal, silver, special, surprise, valentine, white, wish, wrap, xmas, year"
http://ftps1a4l1.adwitads.com/ImageBank/Conceptual/16014342_xxl.jpg,"ad, advertisement, backgrounds, blank, classified ad, classifieds, communication, copy space, education, fake newspaper, media, newspaper, paper, text, word"
http://ftps1a4l1.adwitads.com/ImageBank/Conceptual/16062688_xl.jpg,"advertise, advertising, arm, background, black, blank, business, caucasian, communication, concept, copy space, creativity, draw, drawing, education, empty, female, front view, hand, handwriting, holding, human, idea, information, inspiration, isolated, marker, marketing, message, one, paper, pen, pencil, person, pointing, prepare, presentation, ready, school, showing, sketch, sketching, start, touching, virtual, white, whiteboard, woman, write, writing"
http://ftps1a4l1.adwitads.com/ImageBank/Conceptual/16374607_xxl.jpg,"car, earth, geography, global, journey, map, miniature, miniature car, minicar, paper, toy, travel, world"
http://ftps1a4l1.adwitads.com/ImageBank/Conceptual/16374609_xxl.jpg,"car, earth, geography, global, journey, map, miniature, miniature car, minicar, paper, toy, travel, world"
http://ftps1a4l1.adwitads.com/ImageBank/Conceptual/17056885_xl.jpg,"abstract, alternative, art, bulb, concept, conservation, creative, design, earth, eco, ecologic, ecological, ecology, economical, efficiency, electric, electricity, energy, environment, environmental, equipment, friendly, fuel, future, generation, glass, global, green, house, idea, illustration, innovation, invention, lamp, leaf, light, lightbulb, natural, nature, planet, plant, pollution, power, recycling, renewable, save, sustainable, symbol, technology, white"
http://ftps1a4l1.adwitads.com/ImageBank/Conceptual/17238725_xl.jpg,"ad, announce, boy, business, child, childhood, communication, glasses, herald, kid, loudspeaker, megaphone, nerd, news, scream, shout, speak, speaker, voice, work, young"
http://ftps1a4l1.adwitads.com/ImageBank/Conceptual/18247209_xl.jpg,"alarm, auto, automobile, background, black, business, buy, car, closeup, concept, control, deal, drive, driving, fingers, gift, give, giving, hand, hold, holding, human, key, loan, man, metal, new, one, people, person, plastic, remote, rent, rental, safety, salon, security, service, store, success, system, technology, transport, travel, vehicle"
http://ftps1a4l1.adwitads.com/ImageBank/Conceptual/18936079_xl.jpg,"achieve, award, best, blank, body, body part, challenge, champ, champion, championship, competition, contest, finger, first, gold, golden, good, hand, hold, holding, honor, isolated, isolation, leader, leadership, meadow, medal, medallion, metal, number, number one, object, one, part of body, performance, prize, race, ribbon, sign, sport, sports, success, triumph, trophy, victory, white, win, winner"
http://ftps1a4l1.adwitads.com/ImageBank/Conceptual/1922319_high.jpg,"birthday, bow, christmas, decoration, gift, isolated, large, present, red, ribbon, white, xmas"
http://ftps1a4l1.adwitads.com/ImageBank/Conceptual/19504310_xxl.jpg,"auto, automobile, bright, car, cars, chrome, design, detail, drive, front, head, headlamp, headlight, headlights, lamp, light, lights, metallic, modern, motor, part, reflection, shiny, silver, technology, transport, transportation, vehicle"
http://ftps1a4l1.adwitads.com/ImageBank/Conceptual/2045677_xxl.jpg,"anniversary, birthday, box, celebrate, celebration, christmas, colorful, curling, emotion, especially, forgiveness, friendship, generous, gift, grateful, gratitude, greetings, happy, holiday, joy, joyful, knot, love, mirror, moments, new, occasion, occasions, ornament, package, packaging, party, personal, present, receiving, reflect, reflected, remember, ribbon, sharing, shopping, special, surprise, thank, valentine, wedding, xmas"
http://ftps1a4l1.adwitads.com/ImageBank/Conceptual/2060942_mega.jpg,"adult, adults, attractive, boyfriend, caucasian, color, copy space, couple, do it yourself, domestic scenes, female, girlfriend, green, half length, happiness, happy, home improvement, home owner, horizontal, hug, hugging, husband, indoors, laugh, laughing, love, male, man, mid adult, paint, paintbrush, painting, real estate, relationship, renovate, renovating, renovation, smile, smiling, teamwork, together, togetherness, two people, wall, wife, woman, young adult"
http://ftps1a4l1.adwitads.com/ImageBank/Conceptual/2061054_xxl.jpg,"adult, adults, color, copy space, do it yourself, domestic scenes, female, green, half length, home, home improvement, home owner, house, indoors, mid adult, one person only, paint, paint roller, painting, people, person, pride, proud, real estate, renovate, renovating, renovation, roller, square, wall, woman, women"
http://ftps1a4l1.adwitads.com/ImageBank/Conceptual/2079572_med.jpg,"airport, backpack, bag, black, boy, business, ceiling, connection, construction, flight, girl, gray, grey, heading, immigrant, industry, journey, man, people, person, perspective, silhouette, station, steel, travel, traveller, travellers, travelling, walk, walking, white, window, windows, woman"
http://ftps1a4l1.adwitads.com/ImageBank/Conceptual/20883238_xxl.jpg,"aged, antique, background, black, business, cable, call, classic, communicate, communication, connect, contact, conversation, cord, device, dial, electronics, equipment, fashioned, handset, headphones, headset, hotline, isolated, luxury, nostalgia, number, object, office, old, past, phone, receiver, retro, revival, ringing, rotary, service, shiny, speaking, symbol, talk, technology, telecommunications, telephone, traditional, used, vintage, waiting"
http://ftps1a4l1.adwitads.com/ImageBank/Conceptual/20883240_xxl.jpg,"antique, background, black, business, cable, call, classic, communicate, communication, connect, contact, conversation, cord, device, handset, headphones, headset, hotline, isolated, number, object, old, phone, receiver, retro, revival, service, shiny, speaking, symbol, talk, telecommunications, telephone, vintage, waiting"
http://ftps1a4l1.adwitads.com/ImageBank/Conceptual/2435465_med.jpg,"compost, gardening, gourd, green, growing, growth, leaf, nurture, plant, seedling, shoot, soil, spring, stem, vegetable, young"
http://ftps1a4l1.adwitads.com/ImageBank/Conceptual/2782044_xxl.jpg,"apple, background, calorie, closeup, color, colorful, colour, colourful, cutout, diet, food, fresh, fruit, green, health, healthy, isolated, macro, mature, natural, nutritious, one, organic, pink, red, ripe, single, tasty, vibrant, white"
http://ftps1a4l1.adwitads.com/ImageBank/Conceptual/2904613_xxl.jpg,"apple, apples, background, bite, bitten, calorie, closeup, color, colorful, colour, colourful, cutout, diet, eaten, food, fresh, fruit, green, health, healthy, isolated, macro, mature, natural, nutritious, one, organic, red, ripe, single, tasty, vibrant, white"
http://ftps1a4l1.adwitads.com/ImageBank/Conceptual/2904626_xxl.jpg,"apple, apples, background, bite, bitten, calorie, closeup, color, colorful, colour, colourful, cutout, diet, eaten, food, fresh, fruit, green, health, healthy, isolated, macro, mature, natural, nutritious, one, organic, red, ripe, single, tasty, vibrant, white"
http://ftps1a4l1.adwitads.com/ImageBank/Conceptual/30505989_xxl.jpg,"beautiful, clay, feature, fountain, fresh, garden, green, natural, nature, old, ornament, plant, pottery, pour, reflection, relax, space, splash, spring, summer, tranquil, vintage, water, waterfall, wet"
http://ftps1a4l1.adwitads.com/ImageBank/Conceptual/3420238_med.jpg,"automobiles, bridge, busy, cars, city, downtown, dynamic, evening, highway, horizontal, lights, motion, movement, moving, night, rush hour, scene, streaks, time exposure, traffic jam, transportation, vehicles, warp"
http://ftps1a4l1.adwitads.com/ImageBank/Conceptual/3441289_high.jpg,"advertisement, advertiser, advertising, advertising agency, approval, art design, cmyk, color, color sample, coloring, colour, colour sample, colouring, design, graphic, graphic art, image, lens, lineal, linen tester, litho, magnifying glass, pattern, picture editing, print, print office, print shop, printing industry, printout, proof, ruler, typo"
http://ftps1a4l1.adwitads.com/ImageBank/Conceptual/3465843_high.jpg,"advertisement, advertiser, advertising, advertising agency, approval, art design, cmyk, color, color sample, coloring, colour, colour sample, colouring, design, graphic, graphic art, image, lens, lineal, linen tester, litho, magnifying glass, pattern, picture editing, print, print office, print shop, printing industry, printout, proof, ruler, typo"
http://ftps1a4l1.adwitads.com/ImageBank/Conceptual/3485491_med.jpg,"autumn, baked, bakery, basket, beautiful, beauty, bread, cereals, crop, cultivate, evening, fall, farm, farming, female, field, food, fresh, full, girl, glow, golden, grain, grow, hands, happy, harvest, healthy, household, jug, meal, milk, natural, nature, organic, outdoors, rural, seed, shine, sky, staple, summer, sun, sunset, sunshine, wheat, wicker, woman"
http://ftps1a4l1.adwitads.com/ImageBank/Conceptual/3525545_high.jpg,"background, basket, bow, celebrate, cheer, christmas, christmas present, cold, copy, copy space, december, decorated, decoration, fun, gift, give, giving, happy, holiday, holidays, joy, merry, present, red, ribbon, season, shiny, snow, snowflake, snowflake background, three, tradition, traditional, wicker, winter, wrapped, wrapping paper, xmas"
http://ftps1a4l1.adwitads.com/ImageBank/Conceptual/3557507_mega.jpg,"adult, affection, attractive, blonde, caucasian, color, copy space, couple, domestic life, female, gray hair, green, half length, handsome, happiness, happy, home, home improvement, horizontal, house, hugging, indoors, leisure, lifestyle, looking at viewer, love, male, man, marriage, men, middle aged, paint, paintbrush, painting, people, photograph, portrait, relationship, renovations, romance, sitting, smiling, teamwork, tools, two people, wall, white hair, woman, women"
http://ftps1a4l1.adwitads.com/ImageBank/Conceptual/3569934_xl.jpg,"air, attractive, beautiful, beauty, business, carrier, cloudy, earn, earth, future, globe, leader, light, opportunity, planet, power, progress, sky, success, sun, sunset, universe, view, woman, work, world"
http://ftps1a4l1.adwitads.com/ImageBank/Conceptual/3724899_high.jpg,"affection, affectionate, african american, arm around, at home, celebrating, celebration, child, childhood, christmas, daughter, dress, enjoying, enjoyment, excited, excitement, family, forties, gift, girl, giving, happiness, happy, holding, holiday, image, indoors, inside, kissing, living room, looking at camera, lounge, love, loving, middle aged, mother, parent, present, sitting, smiling, special occasion, surprise, sweater, togetherness, two people, woman"
http://ftps1a4l1.adwitads.com/ImageBank/Conceptual/3991782_xl.jpg,"blue, business, businessman, ceremony, cloud, competition, corporate, cup, executive, first, goal, grab, growing, growth, hand, happiness, hold, holding, joy, man, reach, shiny, sky, succeed, success, successful, symbol, triumph, trophy, victory, win, winner"
http://ftps1a4l1.adwitads.com/ImageBank/Conceptual/4179526_xxl.jpg,"beautiful, blank, board, business, businesswoman, card, confident, devil, display, displaying, executive, finance, financial, head, hold, looking, meeting, over, panel, paper, people, presentation, presenting, sheet, sign, space, woman"
http://ftps1a4l1.adwitads.com/ImageBank/Conceptual/4281153_xxl.jpg,"ad, adults, banner, beautiful, billboard, card, casual, cheerful, cute, diversity, faces, family, female, friends, friendship, girls, group, guy, happiness, happy, hispanic, hold, holding, isolated, joy, latin, male, men, people, person, persons, sign, smile, smiling, students, together, togetherness, unity, white, women, young, youth"
http://ftps1a4l1.adwitads.com/ImageBank/Conceptual/4483102_xl.jpg,"access, agreement, apartment, business, buy, buyer, closing, concept, concepts, contract, deal, estate, finance, financial, gift, giving, gold, hand, hold, holding, investment, key, loan, lock, metal, mortgage, new, object, open, owner, people, person, property, purchase, real, real estate, relocate, rent, safety, sale, sales, secure, security, sell, selling, success, unlock, unlocking"
http://ftps1a4l1.adwitads.com/ImageBank/Conceptual/4678622_xl.jpg,"achievement, air, background, beauty, blue, building, business, climb, cloud, clouds, cloudscape, concept, conceptual, design, door, dream, entrance, frame, freedom, goal, heaven, high, idea, ladder, life, light, new, open, opportunity, paradise, path, progress, rise, sky, space, stair, staircase, stairway, step, structure, success, summer, sun, top, up, wall, way, white, world"
http://ftps1a4l1.adwitads.com/ImageBank/Conceptual/4689722_xl.jpg,"achieve, achievement, authentic, award, background, best, caucasian, challenge, champion, competition, competitive, conquering, cup, determination, elegance, event, female, first, hand, hands, honor, individual, leader, metal, motivation, one, ornamental, person, premium, prises, prize, reflection, reward, shape, shiny, sign, silver, single object, sport, succeed, success, successful, symbol, triumph, trophy, victor, victory, win, winner, winning"
http://ftps1a4l1.adwitads.com/ImageBank/Conceptual/4793777_xxl.jpg,"achievement, award, champions, contest, cup, golden, group, hands, holding, isolated, prize, success, three, trophies, unrecognizable people, victory, white background, winners"
http://ftps1a4l1.adwitads.com/ImageBank/Conceptual/4814639_high.jpg,"foliage, grape, green, leaf, leafy, lush, nature, plant, stem, twig, vine, vineyard, vitis, wine"
http://ftps1a4l1.adwitads.com/ImageBank/Conceptual/5000501_xxl.jpg,"asian, bird, cheerful, cloud, cute, dove, freedom, girl, happy, peace, pigeon, releasing, sky, smiling, sun, white"
http://ftps1a4l1.adwitads.com/ImageBank/Conceptual/5367609_xl.jpg,"ahead, asphalt, auto, automobile, blue, blur, blurred, dawn, drive, empty, environment, escape, fast, field, freedom, freeway, green, highway, horizon, journey, land, landscape, meadow, motion, moving, nature, open, outdoor, outdoors, perspective, race, road, route, sky, speed, speedway, sulight, sun, sunny, sunrise, sunset, transport, transportation, travel, trip, vehicle, way"
http://ftps1a4l1.adwitads.com/ImageBank/Conceptual/542476.jpg,"blue, cap, car, child, childhood, coldly, eye, girl, right, scarf, season, structure, thoughtful, travel, trip"
http://ftps1a4l1.adwitads.com/ImageBank/Conceptual/5460938_xxl.jpg,"abstract, achievement, aspirations, blue, career, cloud, clouds, concept, concepts, design, door, doorway, enter, entrance, freedom, future, hall, heaven, high, home, house, idea, ideas, illustration, life, light, modern, moving, new, open, opportunity, paradise, progress, render, room, sky, space, staircase, stairway, step, steps, structure, success, sun, top, wall, way, white"
http://ftps1a4l1.adwitads.com/ImageBank/Conceptual/5826077_xl.jpg,"adult, anniversary, art, background, birthday, body, bow, box, business, card, celebration, christmas, color, concept, day, decoration, design, gift, girl, give, giving, hand, holding, holiday, human, icon, isolated, love, male, new, object, over, package, paper, party, people, person, present, red, ribbon, romantic, shopping, surprise, valentine, white, winter, women, xmas, year, yellow"
http://ftps1a4l1.adwitads.com/ImageBank/Conceptual/616100_xl.jpg,"background, birthday, blue, bow, box, celebrate, celebration, christmas, december, decoration, few, gift, give, giving, gold, green, greetings, happy, holiday, isolated, many, merry, node, object, party, pleasure, present, pyramid, red, ribbon, round, santa, season, seven, surprise, tape, thanksgiving, valentine, white, winter, wrap, yellow"
http://ftps1a4l1.adwitads.com/ImageBank/Conceptual/6362965_xl.jpg,"accessibility, bizarre, bright, choice, closed, concept, corridor, door, doorway, dream, enter, entering, entrance, exit, freedom, home, hope, house, idea, illusion, illustration, imagination, indoor, inside, inspiration, leaving, life, light, mystery, new, open, opening, opportunity, room, sign, success, surreal, unlocking, way, welcome, white, wooden, world"
http://ftps1a4l1.adwitads.com/ImageBank/Conceptual/6457696_xxl.jpg,"aid, arm, background, care, cutout, defend, defense, embrace, fingers, frame, gesture, hand, human, isolated, neat, protect, protection, protective, secure, security, thumb, white, wrist"
http://ftps1a4l1.adwitads.com/ImageBank/Conceptual/6695701_xxl.jpg,"abc, alphabet, alphabetical, american, asl, background, bright, communicate, communication, concept, conceptual, deaf, education, finger, gesture, gesturing, guide, hand, handicap, hearing, help, human, international, isolated, isolation, language, learn, letter, letters, message, nonverbal, order, part, person, school, sign, signal, spell, spelling, style, symbol, talk, text, thumb, white, woman"
http://ftps1a4l1.adwitads.com/ImageBank/Conceptual/6764924_xl.jpg,"adult, asian, background, balloon, beautiful, beauty, bubble, business, businesswoman, cartoon, chinese, communication, concept, contemplating, contemplative, copy, copyspace, cute, design, female, girl, grey, human, idea, inspiration, isolated, message, pensive, people, person, portrait, pretty, shape, side, smiling, space, speech, student, talking, text, think, thinking, thought, thoughtful, white, woman, women, young"
http://ftps1a4l1.adwitads.com/ImageBank/Conceptual/6870046_xl.jpg,"aerial, background, botany, carpet, close, closeup, clover, color, country, countryside, dark, day, dew, drop, earth, ecology, environment, field, flora, foliage, forest, fresh, garden, grass, green, growth, holiday, ireland, irish, lawn, leaf, luck, lucky, meadow, nature, patrick, plant, saint, shamrock, spring, st, summer, symbol, three, up, waterdrops, wet, wild"
http://ftps1a4l1.adwitads.com/ImageBank/Conceptual/7111282_xl.jpg,"aerial, background, botany, carpet, close, closeup, clover, color, country, countryside, dark, day, dew, drop, earth, ecology, environment, field, flora, foliage, forest, fresh, garden, grass, green, growth, holiday, ireland, irish, lawn, leaf, luck, lucky, meadow, nature, patrick, plant, saint, shamrock, spring, st, summer, symbol, three, up, waterdrops, wet, wild"
http://ftps1a4l1.adwitads.com/ImageBank/Conceptual/7224487_xxl.jpg,"achievement, aspirations, award, awarding, celebration, ceremony, challenge, competition, competitive, conquering, decoration, event, finalist, first, gold, golden, greatest, honor, incentive, individual, isolated, leadership, medal, medallion, motivation, object, place, pride, record, red, ribbon, single, sport, success, symbol, top, winning"
http://ftps1a4l1.adwitads.com/ImageBank/Conceptual/752892_mega.jpg,"boss, business, businessman, businesspeople, businesswomen, career, colleagues, company, cooperation, corporate, crowd, diversity, elegant, entrepreneurs, environment, executive, female, friendly, girl, group, interview, isolated, isolation, leadership, lovers, male, man, masculine, method, office, partners, people, person, project, road to success, smart, staff, success, team, teamwork, white, woman, work, worker"
http://ftps1a4l1.adwitads.com/ImageBank/Conceptual/7599802_xxl.jpg,"abstract, ahead, arrow, asphalt, black, blue, blur, career, cloud, concept, conceptual, dawn, drive, dusk, empty, environment, far, fast, freeway, green, highway, horizon, journey, landscape, motion, movement, moving, nature, nowhere, outdoor, perspective, race, road, route, scenery, sky, speed, speedway, stripped, summer, sunny, sunset, sunshine, transport, travel, trip, view, way, white"
http://ftps1a4l1.adwitads.com/ImageBank/Conceptual/7606514_xl.jpg,"brush, color, fantasy, paint, painting, red, still life, stroke"
http://ftps1a4l1.adwitads.com/ImageBank/Conceptual/7645803_xl.jpg,"abstract, background, barefoot, beach, beautiful, concept, cross, cute, desert, feet, foot, footprint, footstep, human, imprint, journey, landscape, mark, natural, nature, ocean, outdoor, over, person, print, road, sand, sign, silhouette, stamp, step, summer, texture, toe, trace, track, travel, tropical, walk, walking, wallpaper, way, yellow"
http://ftps1a4l1.adwitads.com/ImageBank/Conceptual/7952631_xxl.jpg,"activity, adult, concept, couple, domestic, empty, female, frame, girl, hang, hanging, home, image, indoor, jeans, lifestyle, male, man, moving, people, person, picture, repair, two, wall, white, woman"
http://ftps1a4l1.adwitads.com/ImageBank/Conceptual/8035385_xxl.jpg,"buy, concept, contract, corporate, deal, estate, female, finance, fist, future, gold, golden, hand, home, house, input, investment, key, lock, manicure, new, offer, open, opportunity, ownership, palm, partners, partnership, property, prosperity, real, rent, room, secret, sell, sky, solution, spend, start, success, successful, sun, take, unlock, wealth"
http://ftps1a4l1.adwitads.com/ImageBank/Conceptual/8161317_xl.jpg,"abstract, art, artist, background, blue, brush, bucket, chrome, color, concept, construction, creative, decoration, design, designer, drop, expressing, fun, hobbies, idea, illustration, image, isolated, male, manual, motivation, paint, paintbrush, painter, paintings, pattern, rainbow, red, reflecion, render, roller, shade, shape, tool, wall, wet, white, work, worker"
http://ftps1a4l1.adwitads.com/ImageBank/Conceptual/8235455_xxl.jpg,"above, adult, aspiration, background, beautiful, boy, casual, caucasian, charming, chin, copy space, daydreaming, dreaming, face, friendly, guy, hand, handsome, happy, head, idea, imagination, imagine, isolated, lean, look, looking up, male, man, model, one, pensive, people, person, portrait, relax, relaxing, rest, see, seeing, single, smile, smiling, think, thinking, white, white background, wish, wishing, young"
http://ftps1a4l1.adwitads.com/ImageBank/Conceptual/8235754_xxl.jpg,"beautiful, beginning, business, care, close up, company, concept, conservation, copy space, detail, development, environment, environmental, finance, fresh, green, group, growing, growth, hand, hands, holding, investment, isolated, leaf, life, man, nature, new, palm, people, person, plant, planting, protection, saving, savings, small, solidarity, sprout, success, symbol, team, teamwork, together, tree, unity, white, woman, young"
