URL,Keywords
http://ftps1a4l1.adwitads.com/ImageBank/Automotive & Transportation/Buy Rent/11102289_xxl.jpg,"alarm, approval, approved, auto, automobile, automotive, background, black, business, buttons, car, client, control, dealer, dealership, driving, electronic, garage, hand, handing, hanging, holding, ignition, insertion, insurance, key, keyless, keys, lease, leasing, loan, lock, locked, mechanic, new, plastic, remote, rental, repair, sales, salon, security, service, success, system, transportation, travel, unlock, unlocking, vehicle"
http://ftps1a4l1.adwitads.com/ImageBank/Automotive & Transportation/Buy Rent/12611691_xl.jpg,"adult, adventure, asian, auto, background, beautiful, blue, car, carefree, cars, caucasian, cheerful, chinese, concept, drive, driver, drivers, driving, female, free, freedom, fun, girl, good, happy, holiday, license, lifestyle, new, outdoors, outside, people, person, portrait, road, showing, sky, smile, smiling, spring, summer, sunny, sunshine, teen, teenager, thumbs, thumbs up, tourist, travel, traveling, trip, up, vacation, vehicle, window, woman, women, young"
http://ftps1a4l1.adwitads.com/ImageBank/Automotive & Transportation/Buy Rent/12619698_xl copy.jpg,"adult, attractive, auto, automobile, buy, buyer, buying, car, cheerful, commercial, content, cute, dealer, dealership, excited, excitement, female, girl, gorgeous, happiness, happy, hispanic, holding, joyful, keys, latin, latinamerican, offer, people, person, pretty, purchase, retail, sale, seller, selling, shopper, shopping, smile, smiling, trader, transportation, vehicle, woman, young"
http://ftps1a4l1.adwitads.com/ImageBank/Automotive & Transportation/Buy Rent/15573195_xxl.jpg,"adult, agreement, auto, automobile, black, business, buying, car, caucasian, clipboard, contract, customer, dealership, driver, girl, happiness, human, indoors, male, man, new, people, person, professional, rental, representative, retail, sales, selling, service, shop, shopping, smiling, suit, vehicle, white, woman, young"
http://ftps1a4l1.adwitads.com/ImageBank/Automotive & Transportation/Buy Rent/17644437_xxl.jpg,"adult, adventure, attractive, auto, automobile, beautiful, car, carefree, casual, cheerful, drive, driver, excitement, female, free, freedom, fun, girl, hand, happy, hispanic, holiday, leisure, license, lifestyle, looking, new, one, outdoors, owner, person, portrait, pretty, road, roadtrip, sitting, smile, summer, tourist, transport, transportation, travel, trip, vacation, vehicle, wheel, window, woman, women, young"
http://ftps1a4l1.adwitads.com/ImageBank/Automotive & Transportation/Buy Rent/19124471_xxl.jpg,"adult, alarm, auto, automobile, background, business, buttons, buying, car, caucasian, client, dealer, dealership, drive, driver, driving, exam, garage, girl, hand, happy, holding,insurance, isolated, key, lease, leasing, license, loan, mechanic, new, owner, people, person, portrait, rental, repair, repairing, road, sales, salon, service, smile, transport,transportation, travel, vehicle, white, woman, young"
http://ftps1a4l1.adwitads.com/ImageBank/Automotive & Transportation/Buy Rent/19263429_xl.jpg,"auto, automobile, automotive, background, banknote, bill, business, buy, buying, car, cash, closeup, concept, cost, credit, currency, dollar, driving, expensive, finance, fuel, gasoline, idea, industry, insurance, isolated, loan, macro, money, new, pay, paying, plastic, price, purchase, red, rent, rental, repair, sale, savings, sell, speed, tax, toy, transport, transportation, vehicle, wealth, white"
http://ftps1a4l1.adwitads.com/ImageBank/Automotive & Transportation/Buy Rent/20148753_xxl.jpg,"adult, approval, approving, auto, beautiful, brunette, car, carefree, caucasian, coast, copy space, copyspace, dog, driver, female, freedom, friends, girl, happiness, happy, journey, landscape, leisure, lifestyle, nature, ocean, outdoor, pet, relax, roadtrip, sea, smiling, summer, thumbs up, tourism, tourist, travel, traveler, traveling, trip, vacation, vehicle, wellness, window, woman, young"
http://ftps1a4l1.adwitads.com/ImageBank/Automotive & Transportation/Buy Rent/2118721_xl.jpg,"arms, attention, brand, business, car, cellphone, commuter, corporate, drive, driver, driving, female, girl, happy, inside, joy, new, person, portrait, road, sitting, smiling, steering, success, successful, thumbs, transport, transportation, up, wheel, woman"
http://ftps1a4l1.adwitads.com/ImageBank/Automotive & Transportation/Buy Rent/22770648_l.jpg,"agent, arm, auto, auto service, automobile, automotive, beginning, broker, buy, buyer, buying, car, dealer, dealership, driver, fingers, gift, hand, holding, insurance, investment, key, keychain, keyring, license, loan, lock, new, open, owner, present, property, purchase, rental, rental car, repair, ring, sale, security, sell, seller, selling, service, start, testdrive, transport, unlock, vehicle, win, winner"
http://ftps1a4l1.adwitads.com/ImageBank/Automotive & Transportation/Buy Rent/3203095_xxl.jpg,"adult, adults, african american ethnicity, auto dealership, auto leasing, auto sales, automobile, automobile dealer, automobile dealers, automobile dealership, automobile dealerships, automobile sales, automobile salesman, automobile salesmen, automobile salesperson, automobiles, automotive industry, automotive sales, automotive salesperson, black hair, boyfriend, boyfriends, brown hair, business, businesses, buying, car, car dealer, car dealers, car dealership, car keys, car leasing, car lot, car lots, car sales, car salesman, car salesmen, cars, casual, casual attire, casual clothes, casual clothing, casually dressed, caucasian appearance, choosing, commerce, consumer,consumerism, consumers, corporate, corporation, couple, couples, dark brown hair, dark hair, day, days, daytime, dealer, dealers, dealership, dealerships, emotion,emotions, female, females, girlfriend, girlfriends, half length, handing over, happiness, happy, joy, joyful, joyous, keys, leases, lot, lots, male, males, man, manager, managers,men, mid adult, mid adult couple, mid adult couples, mid adult man, mid adult men, mid adult woman, mid adult women, mid adults, middle age, motor car, motor cars,motor vehicle, motor vehicles, motorcar, motorcars, multi ethnic group, multi racial group, new automobile, new automobiles, new car, new car lot, new car lots, new car manager, new car managers, new cars, new motor car, new motor cars, new motor vehicle, new motor vehicles, only adult, only adults, only mid adult men, only mid adult women, only mid adults, outdoors, partner, partners, people, person, retail, retail scene, retail scenes, retailer, retailers, salesman, salespeople, salesperson, shop, shopper,shoppers, shopping, shopping scene, shopping scenes, smile, smiles, smiling, thirties, three people, three quarter length, together, vertical, waist up, woman, women"
http://ftps1a4l1.adwitads.com/ImageBank/Automotive & Transportation/Buy Rent/3401723_xxl.jpg,"adult, auto, automobile, background, bio, biodiesel, biofuel, biological, car, couple, couples, eco, ecology, ecosystem, elderly, field, fuel, hand, happy, health, healthy, insurance, key, love, male, man, mature, maturity, middleaged, motor, natural, nature, new, old, outdoor, pensioner, people, person, pollution, portrait, retire, retired, retirement, road, security, senior, seniors, smile, smiling, summer, vehicle, white, woman"
http://ftps1a4l1.adwitads.com/ImageBank/Automotive & Transportation/Buy Rent/3472551_xl.jpg,"at camera, automobile, boy, car, caucasian, child, children, convertible, countryside, dad, daughter, day, daytime, drive, driving, enjoying, family, father, female, forties, four people, girl, half length, happy, journey, looking at camera, male, man, middle aged, mom, mother, motor car, motor vehicle, motorcar, mum, new car, outdoors, portrait, seated, sitting, smiling, son, thirties, to camera, trip, woman"
http://ftps1a4l1.adwitads.com/ImageBank/Automotive & Transportation/Buy Rent/6465162_xxl.jpg,"access, alarm, auto, automobile, background, black, business, button, buy, buying, car, concept, control, currency, dollar, finance, hire, idea, ignition, insurance, isolated, key, keys, lock, locking, luxury, money, open, prosperity, remote, rent, rental, repair, safety, sales, savings, secrecy, security, service, success, symbol, technology, toy, transport, transportation, travel, unlocking, vehicle, wealth, white"
http://ftps1a4l1.adwitads.com/ImageBank/Automotive & Transportation/Buy Rent/7510230_xl.jpg,"adults, arms, auto, automobile, background, car, casual, cheerful, come out, coming, couple, excited, excitement, female, girl, guy, happiness, happy, isolated, joyful, lifestyle, male, man, out, people, person, relationship, smile, smiling, successful, together, togetherness, transport, twenties, up, vehicle, white, windows, woman, young"
http://ftps1a4l1.adwitads.com/ImageBank/Automotive & Transportation/Buy Rent/7522107_xl.jpg,"adults, auto, automobile, background, business, car, cheerful, colleagues, confident, corporate, couple, entrepreneur, executive, female, girl, guy, happy, holding, isolated, keys, lifestyle, male, man, partners, partnership, people, person, professional, relationship, smile, smiling, success, successful, transport, twenties, vehicle, white, woman, young"
http://ftps1a4l1.adwitads.com/ImageBank/Automotive & Transportation/Buy Rent/8417608_xxl.jpg,"acceleration, auto, business, buy, car, care, chrome, concept, design, digital, drawing, dream, engine, expensive, fast, finger, fun, giving, hand, illustrations, insurance, lifestyle, lights, little, loan, man, model, new, palm, presentation, protect, protection, race, red, safe, shadow, sold, sport, symbol, tire, vehicle, wheel, white"
http://ftps1a4l1.adwitads.com/ImageBank/Automotive & Transportation/Buy Rent/9981818_xxl.jpg,"adult, adults, asian, auto, beautiful, car, cars, caucasian, chinese, drive, driver, drivers, driving, exam, female, fun, girl, girls, hand, happy, holding, joyful, key, keys, license, lifestyle, new, owner, people, person, portrait, rental, road, seat, showing, sitting, smile, smiling, summer, teen, teenager, travel, trip, vehicle, wheel, white, woman, women, young"
http://ftps1a4l1.adwitads.com/ImageBank/Automotive & Transportation/Car wash/4408076_xl.jpg,"blue, car, car wash, cleaning, foam, foamy, hand, hood, soap, soapy, sponge, wash, washing, wipe, wiping"
http://ftps1a4l1.adwitads.com/ImageBank/Automotive & Transportation/Cars/10049434_xl.jpg,"asphalt, business, car, concepts, danger, design, dreams, drive, elegance, freedom, front, high, highway, image, land, luxury, modern, motor, orange, performance, personal, perspective, race, racecar, red, risk, road, roadster, shift, shiny, sky, smooth, speed, speedometer, sports, status, stock, street, tachometer, tilt, track, transportation, urban, vehicle, view, way, wealth, wheel"
http://ftps1a4l1.adwitads.com/ImageBank/Automotive & Transportation/Cars/10105217_xxl.jpg,"automobile, cars, event, fast, indianapolis, indianapolis motor speedw, motorsports, nascar, race, racing, red bull, rfr, roush fenway, speed, sports, sprint cup series, track, ups"
http://ftps1a4l1.adwitads.com/ImageBank/Automotive & Transportation/Cars/10225221_xl.jpg,"accident, accidents, adrenaline, aerodynamic, auto, automobile, body, car, chase, circuit, city, competition, crash, crashing, crime, danger, dangerous, design, drift, drifting, driver, driving, final, formula, game, grand, individual, insurance, lap, one, performance, police, power, pursuit, race, racing, rally, slide, speed, super, suspect, team, theft, torque, urban, vehicle, wheel, wheels"
http://ftps1a4l1.adwitads.com/ImageBank/Automotive & Transportation/Cars/12649947_xxl.jpg,"auto, automobile, automotive, autoshow, award, awards ceremony, beauty, business, car, car show, celebration, ceremony, cloth, concept, contemporary, cover, covering, design, dream, elegant, engine, enigma, exhibition, expensive, fabric, fast, gift, hidden, hiding, important, innovation, isolated, light, luxury, metal, model, modern, motor, mystery, new, power, present, presentation, prototype, red, salon, satin, secret, shape, sheet, show, showing, showroom, silk, speed, sport, stage, surprise, technology, textile, traffic, transport, transportation, vehicle, wheel"
http://ftps1a4l1.adwitads.com/ImageBank/Automotive & Transportation/Cars/12905013_xxl.jpg,"automobile, automotive, blur, brandless, car, cgi, concept car, coupe, design, driving, fast, generic, luxury, metal, metallic, model, motion, racing, reflection, road, sedan, silver, speed, sportscar, transport, tunnel, vehicle"
http://ftps1a4l1.adwitads.com/ImageBank/Automotive & Transportation/Cars/1297311_xxl.jpg,"auto, automobile, automobiles, autos, car, car lot, cars, dealer, dealership, design, modern, new, retail, sales, shiny, suv, suv's, vehicle, vehicles"
http://ftps1a4l1.adwitads.com/ImageBank/Automotive & Transportation/Cars/15396506_xxl.jpg,"adult, automobile, background, boy, cap, car, cardboard, cargo, courier, deliver, delivering, delivery, driver, driving, employment, friendly, happy, home, house, industry, job, labor, lorry, mail, male, man, messenger, mover, moving, occupation, one, package, people, person, portrait, profession, service, shipping, smiling, transport, transportation, truck, trucking, uniform, vehicle, window, work, worker, working, young"
http://ftps1a4l1.adwitads.com/ImageBank/Automotive & Transportation/Cars/3144483_l.jpg,"abstract, accelerate, accelerated, accident, asphalt, auto, automobile, background, blue, blur, blurred, bright, car, curve, daylight, drive, driver, driveway, fast, faster, futuristic, glass, high, highway, horizontal, line, mirror, motion, movement, outdoors, outside, race, rapid, rear, riding, road, speed, speedlight, speedy, street, traffic, transportation, velocity, view, vignetting, winding, zoom"
http://ftps1a4l1.adwitads.com/ImageBank/Automotive & Transportation/Cars/3339274_xl.jpg,"auto, automobile, blue, car, classic, coupe, expensive, fast, horsepower, hot, isolated, metallic, old, precious, reflection, reflective, retro, ride, rod, sedan, shiny, transportation, valuable, vehicle, vintage, white"
http://ftps1a4l1.adwitads.com/ImageBank/Automotive & Transportation/Cars/3569247_xxl.jpg,"acceleration, attractive, auto, automobile, automotive, car, chrome, color, commercial, concept, coupe, design, detail, dream, drive, elegant, engine, fast, highway, horsepower, hybrid, lifestyle, light, luxury, mask, metal, model, modern, motor, performance, power, presentation, prestige, race, road, rush, speed, sport, style, technology, tire, transport, transportation, unique, vehicle, wheels"
http://ftps1a4l1.adwitads.com/ImageBank/Automotive & Transportation/Cars/391839_xl.jpg,"business, cars, lot, mall, parking, shopping center, space, van."
http://ftps1a4l1.adwitads.com/ImageBank/Automotive & Transportation/Cars/3972407_xxl.jpg,"american, antique, auto, automobile, automotive, car, chrome, classic, convertible, gangster, headlights, hood, hot, hotrod, isolated, nostalgia, nostalgic, old, red, rod, sixties, sports, tires, transportation, vehicle, vintage, white"
http://ftps1a4l1.adwitads.com/ImageBank/Automotive & Transportation/Cars/4139995_high.jpg,"antenna, back, bumper, car, closeup, comfortable exhaust, design, discharge pipe, elegance, flashlight, gray, metal, mirror, model, modern, new, power, rental, retail, sale, shiny, single, sport, stationary, vehicle, white"
http://ftps1a4l1.adwitads.com/ImageBank/Automotive & Transportation/Cars/4165690_xl.jpg,"america, american, auto, automobile, car, classic, cool, coupe, desire, drive, fifties, front, grill, headlamp, headlight, icon, iconic, isolated, legend, light, luxury, old, over, pink, retro, shiny, show, showroom, sixties, timer, tires, transport, transportation, usa, vehicle, wheels, white"
http://ftps1a4l1.adwitads.com/ImageBank/Automotive & Transportation/Cars/4180743_high.jpg,"auto, automobile, background, big, black, car, chrome, cruiser, design, dream, drive, elegant, expensive, fast, front, grand, headlight, isolated, land, large, low, luxury, model, modern, motor, new, offroad, performance, power, prestige, race, side, silver, speed, sport, sporty, strong, style, suv, tire, transport, transportation, truck, tuned, utility, vehicle, wheel, white"
http://ftps1a4l1.adwitads.com/ImageBank/Automotive & Transportation/Cars/4304998_xxl.jpg,"abstract, adventure, background, beach, blue, car, customized, desert, drive, dry, dune, extreme, fun, gold, golden, horizon, hot, illustration, isolated, land, landscape, light, nature, outdoor, power, ripple, road, rough, safari, sand, sky, sport, sports, sun, sunny, suv, terrain, track, trail, transport, transportation, travel, truck, utility, vehicle, water, wheel, yellow"
http://ftps1a4l1.adwitads.com/ImageBank/Automotive & Transportation/Cars/432937_med.jpg,"asphalt, automobile, car, control, countryside, curves, danger, destination, direction, driving, fog, forest, hand, hill, holiday, journey, lane, line, motorway, nature, path, race, ride, road, roadside, roadway, route, signals, speed, speedometer, speedway, traffic, transportation, travel, tree, trip, vacation, vehicle, view, voyage"
http://ftps1a4l1.adwitads.com/ImageBank/Automotive & Transportation/Cars/455622_high.jpg,"aggressive, auto, automobile, back, busy, car, cars, class, concept, daring, design, designer, drive, driver, driving, engine, expensive, fast, front, future, headlight, heady, high speed, innovation, isolated, left, luxury, metal, modeled, models, modern, motor, motors, over white, project, prototype, ride, right, rim, rush, rushed, silver, speeding, speedster, sports, sports car, street, style, tire, top, transportation, wealth, wheel, wheels"
http://ftps1a4l1.adwitads.com/ImageBank/Automotive & Transportation/Cars/4602008_mega.jpg,"aged, agriculture, antique, black, cab, car, classic, collector, contrast, country, distressed, dramatic, dry, equipment, faded, farm, farmland, fashioned, field, grass, hills, horizon, isolated, meadow, monochrome, nobody, nostalgia, obsolete, old, past, pasture, pickup, prairie, relic, retro, rundown, rural, rust, rustic, rusty, studebaker, tank, transportation, truck, vehicle, vertical, weathered, wheel, white"
http://ftps1a4l1.adwitads.com/ImageBank/Automotive & Transportation/Cars/4627367_xl.jpg,"auto, automobile, automotive, beauty, bumper, car, closeup, design, detail, drive, driving, elegant, expensive, fast, front, headlight, lamp, light, luxury, metal, metallic, model, modern, motor, new, performance, power, prestige, red, reflection, sedan, shiny, speed, sport, style, technology, tire, transport, transportation, unique, vehicle, wheel"
http://ftps1a4l1.adwitads.com/ImageBank/Automotive & Transportation/Cars/4627408_xl.jpg,"auto, automobile, back, background, bright, bumper, car, clean, closeup, design, detail, dramatic, drive, european, light, luxury, metal, mirror, model, modern, motor, new, performance, power, race, rear, red, reflection, road, sea, shiny, side, silver, sky, sport, sporty, tail, taillight, tire, transport, transportation, vehicle, view, wheel, white"
http://ftps1a4l1.adwitads.com/ImageBank/Automotive & Transportation/Cars/4653925_xxl.jpg,"action, auto, automobile, automotive, blue, car, drift, drive, fast, japan, japanese, motion, motor, movement, moving, performance, performer, power, race, skyline, speed, sport, sporty, style, technology, tires, transport, transportation, turbo, vehicle, wheel, wheels"
http://ftps1a4l1.adwitads.com/ImageBank/Automotive & Transportation/Cars/4654100_xxl.jpg,"auto, automobile, car, city, drift, drive, engine, fast, motor, night, nismo, power, prix, shift, sky, speed, sport, street, tire, transportation, travel, urban, white"
http://ftps1a4l1.adwitads.com/ImageBank/Automotive & Transportation/Cars/4654126_xxl.jpg,"acceleration, asphalt, auto, automobile, blue, blurred, car, drive, fast, freeway, highway, lifestyle, luxury, metal, motion, motor, move, movement, offroad, performance, race, road, roadster, route, sky, speed, sport, street, style, suv, traffic, transport, transportation, travel, utility, vehicle, wheels, zoom"
http://ftps1a4l1.adwitads.com/ImageBank/Automotive & Transportation/Cars/4753647_xl.jpg,"assurance, auto, automobile, background, car, care, concept, danger, defence, garage, hand, hold, insurance, motor, palm, preservation, protection, protective, safe, safety, toy, transport, vehicle, white"
http://ftps1a4l1.adwitads.com/ImageBank/Automotive & Transportation/Cars/4871986_xl.jpg,"asia, auto, automobile, automotive, business, buy, car, city, colorful, curves, dealer, dealership, design, door, drive, engine, export, finance, garage, industrial, industry, japanese, line, lot, market, modern, motor, new, parked, pattern, patterns, retail, rims, road, row, sale, sales, shape, shiny, sport, style, suv, tires, trade, transport, transportation, truck, urban, vehicle, view, warehouse, wheel, wheels, window, windows"
http://ftps1a4l1.adwitads.com/ImageBank/Automotive & Transportation/Cars/5104600_xxl.jpg,"asphalt, automobiles, building, cars, city, concrete, congestion, full, housetop, jam, land, life, line, lot, massive, mode, motorcar, packed, park, parking, pollution, roof, row, shopping, sign, sky, smog, top, transport, transportation, travel, urban, used, vehicles"
http://ftps1a4l1.adwitads.com/ImageBank/Automotive & Transportation/Cars/5340895_xxl.jpg,"acceleration, alloy, art, auto, automobile, black, bling, bright, bumper, car, chrome, competition, design, detailed, digital, drawing, dream, drive, elegance, elegant, element, engine, expensive, fast, fun, headlights, illustrations, industry, isolate, lifelike, lifestyle, lights, lowered, luxury, model, modern, motor, objects, performance, presentation, prestige, race, real, red, shadow, showroom, speed, sport, style, technology, tires, travel, tyres, vehicle, wheel, white, windows"
http://ftps1a4l1.adwitads.com/ImageBank/Automotive & Transportation/Cars/5408634_xl.jpg,"alloy, angle, art, auto, automobile, bling, bright, bumper, car, cars, chrome, design, detailed, digital, drawing, drive, element, engine, fast, front, headlights, horizontal, illustration, industry, lights, luxury, model, modern, motor, nobody, objects, presentation, real, render, shadow, showroom, speed, style, tires, travel, tyres, vehicle, wheel, white, windows"
http://ftps1a4l1.adwitads.com/ImageBank/Automotive & Transportation/Cars/6444708_xl.jpg,"asphalt, auto, automobile, blue, blur, car, cloud, crop, dramatic, drive, fast, freeway, fuel, highway, horizon, journey, lamp, light, line, metal, middle, motion, perspective, race, road, route, side, sky, speed, spot. orange, tilt, traffic, transport, transportation, trip, turn, urban, vehicle, view, way, wheel, white, wide, window"
http://ftps1a4l1.adwitads.com/ImageBank/Automotive & Transportation/Cars/7051606_xxl.jpg,"auto, automobile, automotive, beauty, bumper, business, car, chrome, closeup, crossover, design, detail, dramatic, drive, elegant, expensive, fast, front, headlight, hood, lamp, light, luxury, metal, metallic, model, modern, motor, performance, power, prestige, race, reflection, shiny, silver, speed, sport, studio, style, technology, tire, transport, transportation, unique, vehicle, view, wheel"
http://ftps1a4l1.adwitads.com/ImageBank/Automotive & Transportation/Cars/7298494_xl.jpg,"automobile, blue, blur, burning, car, cloud, crop, driving, fast, fire, flame, fuel, glitter, high, highway, ice, iron, light, line, metal, mirror, motion, moving, perspective, road, roof, side, sky, speed, spot. orange, surface, tilt, traffic, transport, transportation, turn, up, vehicle, view, way, wheel, white, wide, window"
http://ftps1a4l1.adwitads.com/ImageBank/Automotive & Transportation/Cars/7374015_xxl.jpg,"air, airbus, aircraft, airline, airliner, airplane, airport, aviation, blue, boeing, bus, business, cloud, descend, engine, flight, fly, gear, jet, jetliner, land, landing, off, passenger, pilot, plane, runway, silhouette, sky, sun, take, takeoff, transport, transportation, travel, trip, vacation"
http://ftps1a4l1.adwitads.com/ImageBank/Automotive & Transportation/Cars/7851304_xl.jpg,"asphalt, business, car, city, concepts, danger, design, dreams, drive, elegance, freedom, front, high, highway, image, land, lightning, luxury, modern, motor, personal, perspective, race, red, risk, road, roadster, shift, shiny, sky, smooth, speed, speedometer, sports, status, stock, street, tachometer, tilt, town, track, transportation, urban, view, way, weather, wind, yellowrn"
http://ftps1a4l1.adwitads.com/ImageBank/Automotive & Transportation/Cars/7955764_xl.jpg,"asphalt, auto, automobile, automotive, bumper, car, chrome, concept, design, detail, drive, driver, elegant, engine, fast, fuel, headlight, highway, horsepower, light, luxury, mechanic, mechanical, metal, metallic, motion, motor, performance, power, prestige, race, reflection, repair, road, sign, silver, speed, speedometer, sport, street, style, technology, tire, traffic, transport, transportation, travel, vehicle, wheel, wheels"
http://ftps1a4l1.adwitads.com/ImageBank/Automotive & Transportation/Cars/8333204_xl.jpg,"active, asphalt, back, blue, blur, car, clouds, control, dashboard, distance, driver, driving, finger, front, glass, hand, holding, human, inside, journey, knob, light, male, men, motion, odometer, one, panel, person, piloting, road, safety, sky, speed, steering, traffic, transport, tree, trip, vehicle, view, wheel"
http://ftps1a4l1.adwitads.com/ImageBank/Automotive & Transportation/Cars/849526_med.jpg,"drop shadow, over white, antique, automobiles, black, brass, brown, canopy, cars, classic, convertible, elegant, engine, engineering, enthusiast, green, headlamps, hobbies, hobby, horn, isolated, isolation, lamp, leather, memories, motor, nostalgic, object, old, polished, shiny, technology, tire, transportation, tyre, upholstery, vintage, wheel, yellow"
